Cites,Authors,Title,Year,Source,Publisher,ArticleURL,CitesURL,GSRank,QueryDate,Type,DOI,ISSN,CitationURL,Volume,Issue,StartPage,EndPage,ECC,CitesPerYear,CitesPerAuthor,AuthorCount,Age,Abstract,FullTextURL,RelatedURL
0,"A Thunberg","Cardiovascular Risk Factors Among Patients with type 2 Diabetes in Rural Tanzania.",2015,"","gupea.ub.gu.se","https://gupea.ub.gu.se/handle/2077/39195","",326,"2021-07-31 04:58:08","","","","",,,,,0,0.00,0,1,6,"… situation where one person out of ten will suffer from this condition (1). Furthermore, the numbers would be significantly higher if ”impaired glucose tolerance” and ”impaired fasting glucose” were included. There is a widely spread misconception …","https://gupea.ub.gu.se/bitstream/2077/39195/1/gupea_2077_39195_1.pdf","https://scholar.google.com/scholar?q=related:Zo5u65UQecYJ:scholar.google.com/&scioq=%22impaired+glucose+tolerance%22+nigeria&hl=en&as_sdt=0,5&as_ylo=2015&as_yhi=2015&as_vis=1"
0,"TF Musisi","Effective Communication And Appropriate Lifestyle Behavior",2015,"","81.199.139.27","http://81.199.139.27/handle/123456789/732","",327,"2021-07-31 04:58:08","","","","",,,,,0,0.00,0,1,6,"Page 1. 1 EFFECTIVE COMMUNICATION AND APPROPRIATE LIFESTYLE BEHAVIOR. EXPERIENCES OF TYPE 2 DIABETIC PATIENTS ATTENDING HEALTH WORKER CONSULTATIONS AT INTERNATIONAL HOSPITAL KAMPALA. Theresa Frances Musisi …","http://81.199.139.27/bitstream/handle/123456789/732/MUSISI%20THERESA%20POST%20DEFENSE%20DISSERTATION%202015.pdf?sequence=1&isAllowed=y","https://scholar.google.com/scholar?q=related:HpeRmLaxlrYJ:scholar.google.com/&scioq=%22impaired+glucose+tolerance%22+nigeria&hl=en&as_sdt=0,5&as_ylo=2015&as_yhi=2015&as_vis=1"
1,"VV Annapurna, R Hemalatha, A Raviteja, ...","Selective cecal bacterial changes mediate the adverse effects associated with high palmolein or high starch diets: Prophylactic role of flax oil",2015,"… Journal of Pharmacy …","researchgate.net","https://www.researchgate.net/profile/Venkata-Allam/publication/322197421_SELECTIVE_CECAL_BACTERIAL_CHANGES_MEDIATE_THE_ADVERSE_EFFECTS_ASSOCIATED_WITH_HIGH_PALMOLEIN_OR_HIGH_STARCH_DIETS_PROPHYLACTIC_ROLE_OF_FLAX_OIL_Original_Article/links/5a4ad0e2458515f6b05b44f6/SELECTIVE-CECAL-BACTERIAL-CHANGES-MEDIATE-THE-ADVERSE-EFFECTS-ASSOCIATED-WITH-HIGH-PALMOLEIN-OR-HIGH-STARCH-DIETS-PROPHYLACTIC-ROLE-OF-FLAX-OIL-Original-Article.pdf","https://scholar.google.com/scholar?cites=13810459276193957012&as_sdt=2005&sciodt=0,5&hl=en",328,"2021-07-31 04:58:08","PDF","","","",,,,,1,0.17,0,4,6,"… 4. Wolever TMS, Mehling C. Long term effect of varying the source or amount of dietary carbohydrate on postprandial plasma glucose, insulin, triacylglycerol and free fatty acid concentrations in subjects with impaired glucose tolerance. Am J Clin Nutr 2003;77:612-21 …","https://www.researchgate.net/profile/Venkata-Allam/publication/322197421_SELECTIVE_CECAL_BACTERIAL_CHANGES_MEDIATE_THE_ADVERSE_EFFECTS_ASSOCIATED_WITH_HIGH_PALMOLEIN_OR_HIGH_STARCH_DIETS_PROPHYLACTIC_ROLE_OF_FLAX_OIL_Original_Article/links/5a4ad0e2458515f6b05b44f6/SELECTIVE-CECAL-BACTERIAL-CHANGES-MEDIATE-THE-ADVERSE-EFFECTS-ASSOCIATED-WITH-HIGH-PALMOLEIN-OR-HIGH-STARCH-DIETS-PROPHYLACTIC-ROLE-OF-FLAX-OIL-Original-Article.pdf","https://scholar.google.com/scholar?q=related:lASKboqbqL8J:scholar.google.com/&scioq=%22impaired+glucose+tolerance%22+nigeria&hl=en&as_sdt=0,5&as_ylo=2015&as_yhi=2015&as_vis=1"
0,"M Goboza","The biochemical effects of Hypoxis hemerocallidea in the kidney and liver of streptozotocin-induced diabetic male Wistar rats",2015,"","ir.cput.ac.za","http://ir.cput.ac.za/handle/20.500.11838/2233","",329,"2021-07-31 04:58:08","","","","",,,,,0,0.00,0,1,6,"… Abbreviations: IGT- Impaired glucose tolerance; IFG- Impaired fasting glucose (Diabetes Care, 2011) Fasting glucose indicates to absence of caloric intake in preceding 8hrs, OGTT- oral glucose tolerance … Nigeria tops the list of 5 countries greatly affected by …","http://ir.cput.ac.za/bitstream/20.500.11838/2233/1/210227516_Goboza_M_MTech_Bio_Med_HWSci_2016.pdf","https://scholar.google.com/scholar?q=related:PaI0LMvRC2EJ:scholar.google.com/&scioq=%22impaired+glucose+tolerance%22+nigeria&hl=en&as_sdt=0,5&as_ylo=2015&as_yhi=2015&as_vis=1"
2,"D Ruchugo","Knowledge, attitude and practices of type two diabetes in a rural community in Karatina-Nyeri county",2015,"","erepository.uonbi.ac.ke","http://erepository.uonbi.ac.ke/handle/11295/94825","https://scholar.google.com/scholar?cites=1440637448827213260&as_sdt=2005&sciodt=0,5&hl=en",330,"2021-07-31 04:58:08","","","","",,,,,2,0.33,2,1,6,"… whilst, the prevalence of impaired glucose tolerance is equally high 8.6% in the rural population, and 13.2% in the urban population (Maina et al., 2011) … Recently, researchers have identified impaired glucose tolerance (IGT) and impaired fasting …","http://erepository.uonbi.ac.ke/bitstream/handle/11295/94825/Ruchugo_Knowledge,%20Attitude%20and%20Practices%20of%20Type%20Two%20Diabetes%20in%20a%20Rural%20Community%20in%20Karatina-%20Nyeri%20County.pdf?sequence=3","https://scholar.google.com/scholar?q=related:zJV4eyAs_hMJ:scholar.google.com/&scioq=%22impaired+glucose+tolerance%22+nigeria&hl=en&as_sdt=0,5&as_ylo=2015&as_yhi=2015&as_vis=1"
1,"ASMM Ali, GL Bhuvana","A pilot study to assess diabetes knowledge among diabetics",2015,"Indian Journal of Pharmacy Practice","ijopp.org","http://www.ijopp.org/sites/default/files/10.5530ijopp.8.3.5.pdf","https://scholar.google.com/scholar?cites=9287300883448807508&as_sdt=2005&sciodt=0,5&hl=en",331,"2021-07-31 04:58:08","PDF","","","",,,,,1,0.17,1,2,6,"… Temporal changes in prevalence of diabetes and impaired glucose tolerance associated with lifestyle transition occurring in the rural population in India … Knowledge of diabetes management and control by diabetic patients at federal medical center Umuahia Abia State, Nigeria …","http://www.ijopp.org/sites/default/files/10.5530ijopp.8.3.5.pdf","https://scholar.google.com/scholar?q=related:VEAjgPIe44AJ:scholar.google.com/&scioq=%22impaired+glucose+tolerance%22+nigeria&hl=en&as_sdt=0,5&as_ylo=2015&as_yhi=2015&as_vis=1"
11,"NA Kayar, NO Alptekin, ...","Interleukin-1 receptor antagonist levels in gingival crevicular fluid and serum in nonsmoking women with preterm low birth weight and intrauterine growth retardation",2015,"European journal of …","thieme-connect.com","https://www.thieme-connect.com/products/ejournals/html/10.4103/1305-7456.149655","https://scholar.google.com/scholar?cites=7271629724182948051&as_sdt=2005&sciodt=0,5&hl=en",332,"2021-07-31 04:58:08","","10.4103/1305-7456.149655","","",,,,,11,1.83,4,3,6,"… impaired glucose tolerance and metabolic syndrome regarding their anti-inflammatory effect,[46-49] and decreased in patients with sepsis and septic … JO, Oluwatosin A. Patern and outcome of antenatal care among women atending a Catholic mission hospital in Ibadan, Nigeria …","https://www.thieme-connect.com/products/ejournals/pdf/10.4103/1305-7456.149655.pdf","https://scholar.google.com/scholar?q=related:06gYGLUE6mQJ:scholar.google.com/&scioq=%22impaired+glucose+tolerance%22+nigeria&hl=en&as_sdt=0,5&as_ylo=2015&as_yhi=2015&as_vis=1"
0,"RE Budiati","PEMERIKSAAN KOLONI BAKTERI AIR BAK CUCI DI WARUNG MAKAN PASAR X KABUPATEN KUDUS TAHUN 2015",2015,"JKM (Jurnal Kesehatan Masyarakat …","jurnal.stikescendekiautamakudus.ac …","http://www.jurnal.stikescendekiautamakudus.ac.id/index.php/JKM/article/view/113","",333,"2021-07-31 04:58:08","","","","",,,,,0,0.00,0,1,6,"… (2010). Bacteriological Quality of Food and Water Sold by Vendours and in Restaurant in Nsukka, Nigeria: Assessment of Coliform Contamination, Journal of Food Technology, vol … Hypertension, insulin, and proinsulin in participants with impaired glucose tolerance …","http://www.jurnal.stikescendekiautamakudus.ac.id/index.php/JKM/article/download/113/90","https://scholar.google.com/scholar?q=related:a0UmXhEbov0J:scholar.google.com/&scioq=%22impaired+glucose+tolerance%22+nigeria&hl=en&as_sdt=0,5&as_ylo=2015&as_yhi=2015&as_vis=1"
0,"A Yussif","Serum Leptin and C-reactive protein Levels in Obese Ghanaians with and Without Type 2 Diabetes Mellitus At Korle-Bu Teaching Hospital (KBTH), Accra",2015,"","197.255.68.205","http://197.255.68.205/handle/123456789/22809","",334,"2021-07-31 04:58:08","","","","",,,,,0,0.00,0,1,6,"… Impaired Glucose Tolerance IL-6…………… Interleukin 6 … Amoah et al., (2002) recorded 6.4% prevalence rate for diabetics and 10.7% for impaired glucose tolerance (IGT) in a community in Accra, Ghana. GDHS survey …","http://197.255.68.205/bitstream/handle/123456789/22809/Serum%20Leptin%20and%20C%20-%20reactive%20protein%20Levels%20in%20Obese%20Ghanaians%20With%20and%20Without%20Type%202%20Diabetes%20Mellitus%20at%20Korle-Bu%20Teaching%20Hospital%20%28Kbth%29%2C%20Accra%20-%20Adams%20Yussif.pdf?sequence=1&isAllowed=y","https://scholar.google.com/scholar?q=related:23l9VB96DDcJ:scholar.google.com/&scioq=%22impaired+glucose+tolerance%22+nigeria&hl=en&as_sdt=0,5&as_ylo=2015&as_yhi=2015&as_vis=1"
6,"A Sadeghpour","Chocolate and dental health",2015,"Chocolate and health: chemistry, nutrition and …","books.google.com","https://books.google.com/books?hl=en&lr=&id=Z6SpCQAAQBAJ&oi=fnd&pg=PA196&dq=%22impaired+glucose+tolerance%22+nigeria&ots=hDnOmpKIPo&sig=tKn8izude2zkLFO7m6Ep56_BZ8A","https://scholar.google.com/scholar?cites=15267698412873307670&as_sdt=2005&sciodt=0,5&hl=en",335,"2021-07-31 04:58:08","","","","",,,,,6,1.00,6,1,6,"Page 210. CHAPTER 11 Chocolate and Dental Healthy ARMAN SADEGHPOUR President & CEO, Theodent, The BioInnovation Center, 1441 Canal Street # 411, New Orleans, Louisiana 70112, USA Email: arman@ theodent …","","https://scholar.google.com/scholar?q=related:FtYbldDC4dMJ:scholar.google.com/&scioq=%22impaired+glucose+tolerance%22+nigeria&hl=en&as_sdt=0,5&as_ylo=2015&as_yhi=2015&as_vis=1"
0,"E Ababio","Metabolic Syndrome in Acute Stroke Survivors at Korle-Bu Teaching Hospital",2015,"","ugspace.ug.edu.gh","http://ugspace.ug.edu.gh/handle/123456789/8078","",336,"2021-07-31 04:58:08","","","","",,,,,0,0.00,0,1,6,"Page 1. i METABOLIC SYNDROME IN ACUTE STROKE SURVIVORS AT KORLE-BU TEACHING HOSPITAL BY ABABIO EDWARD (10193217) THIS THESIS IS SUBMITTED TO THE UNIVERSITY OF GHANA, LEGON IN PARTIAL FULFILMENT OF THE REQUIREMENTS …","http://ugspace.ug.edu.gh/bitstream/handle/123456789/8078/ABABIO%20EDWARD%20_METABOLIC%20SYNDROME%20IN%20ACUTE%20STROKE%20SURVIVORS%20AT%20KORLE-BU_2015.pdf?sequence=1&isAllowed=y","https://scholar.google.com/scholar?q=related:hp5wSbpqOtAJ:scholar.google.com/&scioq=%22impaired+glucose+tolerance%22+nigeria&hl=en&as_sdt=0,5&as_ylo=2015&as_yhi=2015&as_vis=1"
0,"AAZ Alsarhan","Identification of Commonly Used Medicinal Plants in Kangkar Pulai and Their Therapeutic Evaluation as Anti-diabetic",2015,"","eprints.utm.my","http://eprints.utm.my/id/eprint/54737/1/AliAtaZidanAlsarhanPFBME2015.pdf","",337,"2021-07-31 04:58:08","PDF","","","",,,,,0,0.00,0,1,6,"… IDDM - Insulin-dependent diabetes mellitus IGT - impaired glucose tolerance Page 16. xvi … In African countries, such as Ghana, Nigeria, Zambia, and Mali, herbal medicine is used to treat 60% of the children affected with malaria. In London, San Francisco, and South Africa, 70 …","http://eprints.utm.my/id/eprint/54737/1/AliAtaZidanAlsarhanPFBME2015.pdf","https://scholar.google.com/scholar?q=related:i4gdaC_vBcoJ:scholar.google.com/&scioq=%22impaired+glucose+tolerance%22+nigeria&hl=en&as_sdt=0,5&as_ylo=2015&as_yhi=2015&as_vis=1"
3,"A Ghalavand, S Shakeriyan, R Rezaee, ...","The effect of resistance training on cardio respiratory factors in men with type 2 diabetes",2015,"Alborz University …","eprints.abzums.ac.ir","http://eprints.abzums.ac.ir/944/","https://scholar.google.com/scholar?cites=10289673630069071527&as_sdt=2005&sciodt=0,5&hl=en",338,"2021-07-31 04:58:08","","","","",,,,,3,0.50,1,4,6,"Page 1. ﻲﺸﻫوﮋﭘ ﻲﻤﻠﻋ ﻪﻳﺮﺸﻧ هرود ،زﺮﺒﻟا ﻲﻜﺷﺰﭘ مﻮﻠﻋ هﺎﮕﺸﻧاد 4 هرﺎﻤﺷ ، 1 ، نﺎﺘﺴﻣز 1393 - تﺎﺤﻔﺻ 67-59 ﺮﻤﺗ ﺮﺛا ﻳ ﺘﻣوﺎﻘﻣ تﺎﻨ ﻲ ﺧﺮﺑ ﺮﺑ ﻲ ﺎﻫرﻮﺘﻛﺎﻓ ي ﺒﻠﻗ ﻲ ﺴﻔﻨﺗ ﻲ د ﻪﺑ ﻼﺘﺒﻣ نادﺮﻣ رد ﻳ ﺖﺑﺎ عﻮﻧ 2 ﺦﻳرﺎﺗ ﺖﻓﺎﻳرد ﻪﻟﺎﻘﻣ : 22/6/ 1393 ؛ ﺦﻳرﺎﺗ شﺮﻳﺬﭘ :12/7/ 1393 ﻣزﻴ فاﺪﻫا و ﻪﻨ : ﻟﺎﻌﻓ ﻴ ﻧﺪﺑ ﺖ ﻲﻳ ﻜ ﻲ د نﺎﻣرد نﺎﻛرا زا ﻳ ﺖﺑﺎ ﻲﻣ ﺪﺷﺎﺑ … ‎","https://eprints.abzums.ac.ir/944/1/Alborz%20Health-v4n1p59-fa.pdf","https://scholar.google.com/scholar?q=related:p574RqZDzI4J:scholar.google.com/&scioq=%22impaired+glucose+tolerance%22+nigeria&hl=en&as_sdt=0,5&as_ylo=2015&as_yhi=2015&as_vis=1"
0,"LHO Ali","Health Education Program to Prevent Foot Complications among Diabetic Patients: A case study of Soba and Ribat Diabetes Health Centers, Khartoum State, Sudan …",2015,"","repo.uofg.edu.sd","http://repo.uofg.edu.sd/handle/123456789/1675","",339,"2021-07-31 04:58:08","","","","",,,,,0,0.00,0,1,6,"Page 1. 1 Health Education Program to Prevent Foot Complications among Diabetic Patients: A case study of Soba and Ribat Diabetes Health Centers, Khartoum State, Sudan (2010 - 2013) Lubna Hassan Osman Ali B.Sc. in nursing, Pahlvi University, Shiraz Iran (1973) …","http://repo.uofg.edu.sd/bitstream/handle/123456789/1675/Lubna%20Hassan%20Osman%20Ali.pdf?sequence=1&isAllowed=y","https://scholar.google.com/scholar?q=related:sNcSOEksgLwJ:scholar.google.com/&scioq=%22impaired+glucose+tolerance%22+nigeria&hl=en&as_sdt=0,5&as_ylo=2015&as_yhi=2015&as_vis=1"
0,"EMA Albadawi","Community Based Interactive Approach for Type 2 Diabetic Patients at Addaraja Health Center, Wad Medani, Sudan",2015,"","repo.uofg.edu.sd","http://repo.uofg.edu.sd/handle/123456789/2968","",340,"2021-07-31 04:58:08","","","","",,,,,0,0.00,0,1,6,"… Page 25. 25 In Nigeria Olaitan (July, 2012) asses the Patients' knowledge of causes, effects and complications of diabetes mellitus in Ilorin Kwara state , Nigeria and documented that … State, Nigeria. Sexual dysfunction and infertility have been associated with effects of diabetes …","http://repo.uofg.edu.sd/bitstream/handle/123456789/2968/Eman%20Mohammed%20Ali%20Albadawi.pdf?sequence=1","https://scholar.google.com/scholar?q=related:DpADLSOkhqEJ:scholar.google.com/&scioq=%22impaired+glucose+tolerance%22+nigeria&hl=en&as_sdt=0,5&as_ylo=2015&as_yhi=2015&as_vis=1"
1,"M Geneto, M Umeta, T Kebede, A Azazh, ...","A Comparative Study on Serum Level Concentration of Micronutrients Like Zinc, Copper and Chromium Status in Type 2 Diabetic Patients in Diabetes & …",2015,"Journal of Pharmacy …","researchgate.net","https://www.researchgate.net/profile/Tedla-Kebede/publication/276463457_A_Comparative_Study_on_Serum_Level_Concentration_of_Micronutrients_Like_Zinc_Copper_and_Chromium_Status_in_Type_2_Diabetic_Patients_in_Diabetes_Endocrinology_Unit_Tikur_Anbessa_Specialized_Hospital_Et/links/5a69ce864585154d1545066c/A-Comparative-Study-on-Serum-Level-Concentration-of-Micronutrients-Like-Zinc-Copper-and-Chromium-Status-in-Type-2-Diabetic-Patients-in-Diabetes-Endocrinology-Unit-Tikur-Anbessa-Specialized-Hospita.pdf","https://scholar.google.com/scholar?cites=17777683078228714590&as_sdt=2005&sciodt=0,5&hl=en",341,"2021-07-31 04:58:08","PDF","","","",,,,,1,0.17,0,5,6,"… urine levelsof zinc, magnesium, selenium and chromium in type-2 diabetics in Calabar, Nigeria … toxic element patterns in nonsmoker patients with noninsulin-dependent diabetes mellitus, impaired glucose tolerance, and fasting … Low serum chromium in Nigerian Type 2 diabetes …","https://www.researchgate.net/profile/Tedla-Kebede/publication/276463457_A_Comparative_Study_on_Serum_Level_Concentration_of_Micronutrients_Like_Zinc_Copper_and_Chromium_Status_in_Type_2_Diabetic_Patients_in_Diabetes_Endocrinology_Unit_Tikur_Anbessa_Specialized_Hospital_Et/links/5a69ce864585154d1545066c/A-Comparative-Study-on-Serum-Level-Concentration-of-Micronutrients-Like-Zinc-Copper-and-Chromium-Status-in-Type-2-Diabetic-Patients-in-Diabetes-Endocrinology-Unit-Tikur-Anbessa-Specialized-Hospita.pdf","https://scholar.google.com/scholar?q=related:XqRLx5EEt_YJ:scholar.google.com/&scioq=%22impaired+glucose+tolerance%22+nigeria&hl=en&as_sdt=0,5&as_ylo=2015&as_yhi=2015&as_vis=1"
0,"N Hejazi, R Rajikan","Metabolic Abnormalities in HIV-Infected Populations without or with Antiretroviral Therapy (ART)",2015,"Health of HIV Infected People","Elsevier","https://www.sciencedirect.com/science/article/pii/B9780128007693000020","",342,"2021-07-31 04:58:08","","","","",,,,,0,0.00,0,2,6,"… IR and serum glucose irregularities lead to numerous morbid illnesses, including impaired glucose tolerance (IGT), type 2 diabetes mellitus (T2DM), hypertension, coronary heart diseases (CHDs), and CVDs [3], [4]. However HIV-associated body fat disorders are typically …","",""
21,"JW Rich-Edwards, RB Ness, JM Roberts","Epidemiology of pregnancy-related hypertension",2015,"… Hypertensive Disorders in …","Elsevier","https://www.sciencedirect.com/science/article/pii/B9780124078666000031","https://scholar.google.com/scholar?cites=7266421132232595721&as_sdt=2005&sciodt=0,5&hl=en",343,"2021-07-31 04:58:08","","","","",,,,,21,3.50,7,3,6,"… Roberts, 2010 19, Antioxidant trial: USA, healthy nullipara, 4,993, 19.9%, 6.7%, 0.1%. Hypertensive disorders defined by mixed methods. Abalos, 2013 20, Africa (AFRO), 93,613 (57% Nigerian), 4.0%, 2.7%. Americas (AMRO), 36,693,594 (99% US), 2.3%, 1.1 …","","https://scholar.google.com/scholar?q=related:CZkdR4WD12QJ:scholar.google.com/&scioq=%22impaired+glucose+tolerance%22+nigeria&hl=en&as_sdt=0,5&as_ylo=2015&as_yhi=2015&as_vis=1"
0,"EW Gregg","Diabetes in Socioeconomically Vulnerable Populations",,"downloads.hindawi.com","","https://downloads.hindawi.com/journals/specialissues/320763.pdf","",344,"2021-07-31 04:58:08","PDF","","","",,,,,0,0.00,0,1,,"… Diabetes mellitus (DM) is a global epidemic that is increasing rapidly. An estimated 415 million people worldwide currently live with DM and another 318 million people have impaired glucose tolerance (IGT), a marker for future DM …","https://downloads.hindawi.com/journals/specialissues/320763.pdf","https://scholar.google.com/scholar?q=related:syqmHVFkWNAJ:scholar.google.com/&scioq=%22impaired+glucose+tolerance%22+nigeria&hl=en&as_sdt=0,5&as_ylo=2015&as_yhi=2015&as_vis=1"
0,"A Dickinson","Application of Next Generation Sequencing on Population and Medical Genomics",,"ukm.my","","https://www.ukm.my/umbi/wp-content/uploads/RCMM_ABSTRACT_BOOK_2015_final.pdf","",345,"2021-07-31 04:58:08","PDF","","","",,,,,0,0.00,0,1,,"… diabetes. Like diabetes, pre-diabetes is characterised by insulin resistance and impaired insulin secretion. Prediabetes comprised of either impaired fasting glucose (IFG) or impaired glucose tolerance (IGT) or both. Based on …","https://www.ukm.my/umbi/wp-content/uploads/RCMM_ABSTRACT_BOOK_2015_final.pdf",""
0,"MNJ Al-Darrji, AF Shehab, NY Yaseen, RM Karim","مﻳزﻧاو نوﻫدﻟا مﺳﺗرﻣ تﺎﻳوﺗﺳﻣ ﻲﻓ تارﻳﺎﻐﺗﻟا ﺔﺳارد GLP-1 نﻣ ﺔﻧﻳﻋ ﻲﻓ ﺔﻧادﺑﻟﺎﺑ نﻳﺑﺎﺻﻣﻠﻟ ﻲﻗارﻌﻟا ﻊﻣﺗﺟﻣﻟا‎",,"iasj.net","","https://www.iasj.net/iasj/download/e429aa13e289cdad","",346,"2021-07-31 04:58:08","PDF","","","",,,,,0,0.00,0,4,,"Page 1. ﻲﺟاردﻟا نورﺧاو موﻠﻌﻠﻟ ﺔﻳﻗارﻌﻟا ﺔﻠﺟﻣﻟا ، 2015 ، دﻠﺟﻣ 56 ، ددﻌﻟا 2 ج، ﺔﺣﻔﺻﻟا 1639 - 1652 _____ *Email: m79n2008@yahoo.com 1639 مﻳزﻧاو نوﻫدﻟا مﺳﺗرﻣ تﺎﻳوﺗﺳﻣ ﻲﻓ تارﻳﺎﻐﺗﻟا ﺔﺳارد GLP-1 نﻣ ﺔﻧﻳﻋ ﻲﻓ ﺔﻧادﺑﻟﺎﺑ نﻳﺑﺎﺻﻣﻠﻟ ﻲﻗارﻌﻟا ﻊﻣﺗﺟﻣﻟا … ‎","https://www.iasj.net/iasj/download/e429aa13e289cdad","https://scholar.google.com/scholar?q=related:zF2CBA_pRW0J:scholar.google.com/&scioq=%22impaired+glucose+tolerance%22+nigeria&hl=en&as_sdt=0,5&as_ylo=2015&as_yhi=2015&as_vis=1"
0,"R Zubair, I Aliyu","P7 Non-toxic Antiproliferative Effect of Ficus carica Extracts on Oestrogens Receptor Breast Cancer Cell Line (MCF-7)",2015,"","researchgate.net","https://www.researchgate.net/profile/Idris-Aliyu-3/publication/283350220_P7_Non-toxic_Antiproliferative_Effect_of_Ficus_carica_Extracts_on_Oestrogens_Receptor_Breast_Cancer_Cell_Line_MCF-7/links/5644a57f08ae9f9c13e56406/P7-Non-toxic-Antiproliferative-Effect-of-Ficus-carica-Extracts-on-Oestrogens-Receptor-Breast-Cancer-Cell-Line-MCF-7.pdf","",347,"2021-07-31 04:58:08","PDF","","","",,,,,0,0.00,0,2,6,"… diabetes. Like diabetes, pre-diabetes is characterised by insulin resistance and impaired insulin secretion. Prediabetes comprised of either impaired fasting glucose (IFG) or impaired glucose tolerance (IGT) or both. Based on …","https://www.researchgate.net/profile/Idris-Aliyu-3/publication/283350220_P7_Non-toxic_Antiproliferative_Effect_of_Ficus_carica_Extracts_on_Oestrogens_Receptor_Breast_Cancer_Cell_Line_MCF-7/links/5644a57f08ae9f9c13e56406/P7-Non-toxic-Antiproliferative-Effect-of-Ficus-carica-Extracts-on-Oestrogens-Receptor-Breast-Cancer-Cell-Line-MCF-7.pdf",""
1,"PI Burgess","Determinants of severity and progression of diabetic retinopathy in Southern Malawi",2015,"","search.proquest.com","https://search.proquest.com/openview/f90d5b755c80daf0b9430d29cbee440c/1?pq-origsite=gscholar&cbl=51922","https://scholar.google.com/scholar?cites=7401369502983602998&as_sdt=2005&sciodt=0,5&hl=en",348,"2021-07-31 04:58:08","BOOK","","","",,,,,1,0.17,1,1,6,"Page 1. DETERMINANTS OF SEVERITY AND PROGRESSION OF DIABETIC RETINOPATHY IN SOUTHERN MALAWI Thesis submitted in accordance with the requirements of the University of Liverpool for the degree of Doctor in Philosophy Philip Ian Burgess July 2015 …","https://livrepository.liverpool.ac.uk/2033719/1/BurgessPhi_July2015_2033719.pdf","https://scholar.google.com/scholar?q=related:NkO_TFnytmYJ:scholar.google.com/&scioq=%22impaired+glucose+tolerance%22+nigeria&hl=en&as_sdt=0,5&as_ylo=2015&as_yhi=2015&as_vis=1"
2,"王宁, 秦明照, 崔晶","女性心血管疾病风险",2015,"临床荟萃","lchc.hebmu.edu.cn","http://lchc.hebmu.edu.cn/CN/article/downloadArticleFile.do?attachType=PDF&id=1145","https://scholar.google.com/scholar?cites=3303491506757210143&as_sdt=2005&sciodt=0,5&hl=en",349,"2021-07-31 04:58:08","PDF","","","",,,,,2,0.33,1,3,6,"… [25] Igweh JC,Nwagha IU,Okaro JM.The effects of menopause on the serum lipid profile of normal females of South East Nigeria[J].Niger J … who is really at risk [J].Fertil Steril, 2014,102(5):1444- 145 1 . [46] Moran LJ,Misso ML, Wild RA, et al.Impaired glucose tolerance, type 2 …","http://lchc.hebmu.edu.cn/CN/article/downloadArticleFile.do?attachType=PDF&id=1145","https://scholar.google.com/scholar?q=related:H5DI0gVc2C0J:scholar.google.com/&scioq=%22impaired+glucose+tolerance%22+nigeria&hl=en&as_sdt=0,5&as_ylo=2015&as_yhi=2015&as_vis=1"
2,"VK Brennan, J Mauskopf, AD Colosia, ...","Utility estimates for patients with Type 2 diabetes mellitus after experiencing a myocardial infarction or stroke: a systematic review",2015,"Expert review of …","Taylor & Francis","https://www.tandfonline.com/doi/abs/10.1586/14737167.2015.965152","https://scholar.google.com/scholar?cites=5731537212395297918&as_sdt=2005&sciodt=0,5&hl=en",350,"2021-07-31 04:58:08","","10.1586/14737167.2015.965152","","",,,,,2,0.33,1,4,6,"… 0.04, 0.08, [15]. Adibe ‡ et al. (2013) Nigeria, 638 from 2 Nigerian hospitals, Not reported, HUI2 and HUI3, Algorithm used not stated, No, Neither, HUI3 0.226; HUI2 0.077, HUI3 0.590 HUI2 0.370, [16]. Solli et al. (2010) Norway, 356 …","","https://scholar.google.com/scholar?q=related:fhzBSbqCik8J:scholar.google.com/&scioq=%22impaired+glucose+tolerance%22+nigeria&hl=en&as_sdt=0,5&as_ylo=2015&as_yhi=2015&as_vis=1"
7,"YK Yasin, MI Kartasurya, ...","Pengaruh kombinasi vitamin c dan vitamin e terhadap Kadar malondialdehid plasma pasien diabetes mellitus tipe 2",2015,"Jurnal Gizi Indonesia (The …","ejournal.undip.ac.id","https://ejournal.undip.ac.id/index.php/jgi/article/view/12321","https://scholar.google.com/scholar?cites=7863041778270795998&as_sdt=2005&sciodt=0,5&hl=en",351,"2021-07-31 04:58:08","","","","",,,,,7,1.17,2,3,6,"… Effect of vitamin on malondialdehyde and glutathione levels in type 2 diabetic Nigerians … postprandial oxidative stress and endothelial dysfunction: a single-blind, 15-day clinical trial in patients with untreated type 2 diabetes, subject with impaired glucose tolerance, and healthy …","https://ejournal.undip.ac.id/index.php/jgi/article/viewFile/12321/9327","https://scholar.google.com/scholar?q=related:3vjiT9YiH20J:scholar.google.com/&scioq=%22impaired+glucose+tolerance%22+nigeria&hl=en&as_sdt=0,5&as_ylo=2015&as_yhi=2015&as_vis=1"
26,"P Gluckman, M Hanson, CY Seng, A Bardsley","Nutrition and lifestyle for pregnancy and breastfeeding",2015,"","books.google.com","https://books.google.com/books?hl=en&lr=&id=1s2SBQAAQBAJ&oi=fnd&pg=PP1&dq=%22impaired+glucose+tolerance%22+nigeria&ots=8DXS3_UV7d&sig=lFoTGwJ3u49IWOBS0XqUjmeGEBA","https://scholar.google.com/scholar?cites=4043599995532023002&as_sdt=2005&sciodt=0,5&hl=en",352,"2021-07-31 04:58:08","BOOK","","","",,,,,26,4.33,7,4,6,"Page 1. NUTRITION & LIFESTYLE FOR PREGNANCY & BREASTFEEDING Peter Gluckman, Mark Hanson, Chong Yap Seng, & Anne Bardsley Page 2. Nutrition and Lifestyle for Pregnancy and Breastfeeding Sir Peter Gluckman …","","https://scholar.google.com/scholar?q=related:2hR1o8XAHTgJ:scholar.google.com/&scioq=%22impaired+glucose+tolerance%22+nigeria&hl=en&as_sdt=0,5&as_ylo=2015&as_yhi=2015&as_vis=1"
