Cites,Authors,Title,Year,Source,Publisher,ArticleURL,CitesURL,GSRank,QueryDate,Type,DOI,ISSN,CitationURL,Volume,Issue,StartPage,EndPage,ECC,CitesPerYear,CitesPerAuthor,AuthorCount,Age,Abstract,FullTextURL,RelatedURL
2,"OM Omisore, BA Ojokoh, AE Babalola, T Igbe…","An affective learning-based system for diagnosis and personalized management of diabetes mellitus",2021,"Future Generation …","Elsevier","https://www.sciencedirect.com/science/article/pii/S0167739X20330193","https://scholar.google.com/scholar?cites=3529035830432191068&as_sdt=2005&sciodt=0,5&hl=en",337,"2021-07-31 07:13:36","","","","",,,,,2,2.00,0,5,1,"… are publicly available. Then, the model was applied retrospectively on a private dataset consisting of 14 female patients' records obtained at Obafemi Awolowo University Teaching Hospital Complex, Ile-Ife, Nigeria. Also, the …","","https://scholar.google.com/scholar?q=related:XFKJ4GOn-TAJ:scholar.google.com/&scioq=%22impaired+glucose+tolerance%22+nigeria&hl=en&as_sdt=0,5&as_ylo=2020&as_yhi=2021&as_vis=1"
1,"QU Ahmed, AHM Ali, S Mukhtar, MA Alsharif…","Medicinal potential of isoflavonoids: Polyphenols that may cure diabetes",2020,"Molecules","mdpi.com","https://www.mdpi.com/900000","https://scholar.google.com/scholar?cites=4321417885763305641&as_sdt=2005&sciodt=0,5&hl=en",338,"2021-07-31 07:13:36","","","","",,,,,1,1.00,0,5,1,"… 3. Department of Chemistry, Faculty of Science, University of Tabuk, Tabuk 71491, Saudi Arabia. 4. Department of Pharmaceutical and Medicinal Chemistry, Faculty of Pharmaceutical Sciences, Usmanu Danfodiyo University, PMB: 2436 Sokoto, Nigeria …","https://www.mdpi.com/1420-3049/25/23/5491/pdf","https://scholar.google.com/scholar?q=related:qQDx1qvC-DsJ:scholar.google.com/&scioq=%22impaired+glucose+tolerance%22+nigeria&hl=en&as_sdt=0,5&as_ylo=2020&as_yhi=2021&as_vis=1"
0,"K Bhattacharya, P Sengupta, S Dutta, P Chaudhuri…","Waist-to-height ratio and BMI as predictive markers for insulin resistance in women with PCOS in Kolkata, India",2021,"Endocrine","Springer","https://link.springer.com/article/10.1007/s12020-020-02555-3","",339,"2021-07-31 07:13:36","","10.1007/s12020-020-02555-3","","",,,,,0,0.00,0,5,1,"Polycystic ovarian syndrome (PCOS) is most commonly presented with insulin resistance (IR). Simple anthropometric indices may serve as surrogate markers of.","","https://scholar.google.com/scholar?q=related:TBR_Dh4HRiYJ:scholar.google.com/&scioq=%22impaired+glucose+tolerance%22+nigeria&hl=en&as_sdt=0,5&as_ylo=2020&as_yhi=2021&as_vis=1"
12,"N Tran, B Pham, L Le","Bioactive compounds in anti-diabetic plants: From herbal medicine to modern drug discovery",2020,"Biology","mdpi.com","https://www.mdpi.com/810950","https://scholar.google.com/scholar?cites=18359067626518294098&as_sdt=2005&sciodt=0,5&hl=en",340,"2021-07-31 07:13:36","","","","",,,,,12,12.00,4,3,1,"… Most adults with impaired glucose tolerance are under the age of 50 years (180.0 million–48.1%) … the world, there are top 10 countries that have numbers of people with diabetes, including China, the USA, Indonesia, India, Brazil, Mexico, Japan, Pakistan, Thailand, and Nigeria …","https://www.mdpi.com/2079-7737/9/9/252/pdf","https://scholar.google.com/scholar?q=related:Ui7_XbyCyP4J:scholar.google.com/&scioq=%22impaired+glucose+tolerance%22+nigeria&hl=en&as_sdt=0,5&as_ylo=2020&as_yhi=2021&as_vis=1"
0,"S Kumar, A Kumari, SC Agrawal","Pattern of kidney diseases in Northern India: an overview through histopathological findings in biopsy-proven cases",2020,"The Egyptian Journal of Internal …","Springer","https://link.springer.com/article/10.1186/s43162-020-00021-0","",341,"2021-07-31 07:13:36","HTML","10.1186/s43162-020-00021-0","","",,,,,0,0.00,0,3,1,"A kidney biopsy is being increasingly performed for the diagnosis of renal diseases. It is a reasonably safe procedure that helps not only to reach the correct diagnosis based on histopathological findings but also helps in predicting the clinical course and outcome. The pattern …","https://link.springer.com/article/10.1186/s43162-020-00021-0","https://scholar.google.com/scholar?q=related:_BHFy7_QyNMJ:scholar.google.com/&scioq=%22impaired+glucose+tolerance%22+nigeria&hl=en&as_sdt=0,5&as_ylo=2020&as_yhi=2021&as_vis=1"
1,"TM Salman, IA Alagbonsi, SO Sulaiman","Counter-regulatory responses to Telfairia occidentalis-induced hypoglycaemia",2020,"Metabolism Open","Elsevier","https://www.sciencedirect.com/science/article/pii/S2589936820300451","https://scholar.google.com/scholar?cites=15836979396564331480&as_sdt=2005&sciodt=0,5&hl=en",342,"2021-07-31 07:13:36","HTML","","","",,,,,1,1.00,0,3,1,"… Telfairia occidentalis Hook.f. (TO), commonly called fluted pumpkin or fluted gourd, is a plant belonging to the family of Cucurbitaceae that is consumed mostly in West African countries such as Nigeria, Ghana and Sierra Leone [1,2]. In Nigeria, TO is known by different names …","https://www.sciencedirect.com/science/article/pii/S2589936820300451","https://scholar.google.com/scholar?q=related:2Ktlb9pAyNsJ:scholar.google.com/&scioq=%22impaired+glucose+tolerance%22+nigeria&hl=en&as_sdt=0,5&as_ylo=2020&as_yhi=2021&as_vis=1"
2,"TD Alabi, NL Brooks, OO Oguntibeju","Antioxidant status and hepato-protective role of Anchomanes difformis in streptozotocin-induced diabetes in male Wistar rats",2020,"Herba Polonica","herbapolonica.pl","http://www.herbapolonica.pl/magazines-files/2920690-Alabi%20et%20al.pdf","https://scholar.google.com/scholar?cites=15622810861590126375&as_sdt=2005&sciodt=0,5&hl=en",343,"2021-07-31 07:13:36","PDF","","","",,,,,2,2.00,1,3,1,"… blume) were harvested from a farm in Abeokuta, Ogun state, Nigeria. The authentication was conducted by OO Oyebanji at the Herbarium, Department of Botany, University of Lagos, Nigeria (LUH6623), a specimen voucher was deposited at the herbari- um …","http://www.herbapolonica.pl/magazines-files/2920690-Alabi%20et%20al.pdf","https://scholar.google.com/scholar?q=related:J58xlrRfz9gJ:scholar.google.com/&scioq=%22impaired+glucose+tolerance%22+nigeria&hl=en&as_sdt=0,5&as_ylo=2020&as_yhi=2021&as_vis=1"
0,"NCDRF Collaboration","Worldwide trends in diabetes since 1980: pooled analysis of 751 population-based measurement studies with over 4.4 million participants",,"research-repository.griffith.edu.au","","https://research-repository.griffith.edu.au/bitstream/handle/10072/394831/Ahmadvand431752-Accepted.pdf?sequence=2","",344,"2021-07-31 07:13:36","PDF","","","",,,,,0,0.00,0,1,,"… As these policies are implemented, identifying people at high risk of diabetes, especially those with impaired glucose tolerance, through the primary care system and using … Eruke E Egbagbe (University of Benin, Nigeria)*; Robert Eggertsen (University of Gothenburg …","https://research-repository.griffith.edu.au/bitstream/handle/10072/394831/Ahmadvand431752-Accepted.pdf?sequence=2","https://scholar.google.com/scholar?q=related:hvqSF5TfLYkJ:scholar.google.com/&scioq=%22impaired+glucose+tolerance%22+nigeria&hl=en&as_sdt=0,5&as_ylo=2020&as_yhi=2021&as_vis=1"
0,"OA Oyesola, PHD Shallie, O Osonuga…","Momordica charantia improves biochemical indices in alloxan-induced diabetic rat model",2020,"National Journal of …","njppp.com","http://www.njppp.com/fulltext/28-1593023111.pdf","",345,"2021-07-31 07:13:36","PDF","","","",,,,,0,0.00,0,4,1,"… The anti-diabetic drug (PerglimM-2) was purchased from a reputable pharmaceutical store in Ogun state Nigeria. Five hundred milligram of drug dissolved in 125 ml of normal saline was orally administered at 1.43 mg/100 g rat weight … Diabetes and impaired glucose tolerance …","http://www.njppp.com/fulltext/28-1593023111.pdf","https://scholar.google.com/scholar?q=related:1DUroXjOCB0J:scholar.google.com/&scioq=%22impaired+glucose+tolerance%22+nigeria&hl=en&as_sdt=0,5&as_ylo=2020&as_yhi=2021&as_vis=1"
3,"B Wernly, S Wernly, A Magnano, E Paul","Cardiovascular health care and health literacy among immigrants in Europe: a review of challenges and opportunities during the COVID-19 pandemic",2020,"Journal of Public Health","Springer","https://link.springer.com/article/10.1007/s10389-020-01405-w","https://scholar.google.com/scholar?cites=17698522310570594806&as_sdt=2005&sciodt=0,5&hl=en",346,"2021-07-31 07:13:36","HTML","10.1007/s10389-020-01405-w","","",,,,,3,3.00,1,4,1,"Europe is a destination for many migrants, a group whose proportion of the overall population will increase over the next decades. The cardiovascular (CV).","https://link.springer.com/article/10.1007/s10389-020-01405-w","https://scholar.google.com/scholar?q=related:9tHiSkXInfUJ:scholar.google.com/&scioq=%22impaired+glucose+tolerance%22+nigeria&hl=en&as_sdt=0,5&as_ylo=2020&as_yhi=2021&as_vis=1"
1,"Y Commodore-Mensah, C Agyemang…","Obesity and cardiovascular disease risk among Africans residing in Europe and Africa: the RODAM study",2020,"Obesity research & …","Elsevier","https://www.sciencedirect.com/science/article/pii/S1871403X19305368","https://scholar.google.com/scholar?cites=381268719023404910&as_sdt=2005&sciodt=0,5&hl=en",347,"2021-07-31 07:13:36","","","","",,,,,1,1.00,0,3,1,"… 30]. Among urban Nigerian men and women, WC was a stronger predictor of glucose intolerance and high blood pressure than WHR and higher income was associated with a higher prevalence of central obesity [31]. Among …","","https://scholar.google.com/scholar?q=related:brdbQeGJSgUJ:scholar.google.com/&scioq=%22impaired+glucose+tolerance%22+nigeria&hl=en&as_sdt=0,5&as_ylo=2020&as_yhi=2021&as_vis=1"
0,"G Oboh, TG Bello, OM Agunloye","Effect of biscuits formulated from acha–sandpaper leaf composite flour on fasting blood glucose, blood pressure, and activities of key enzymes linked to diabetes and …",2021,"Journal of Food Biochemistry","Wiley Online Library","https://onlinelibrary.wiley.com/doi/abs/10.1111/jfbc.13843","",348,"2021-07-31 07:13:36","","10.1111/jfbc.13843","","",,,,,0,0.00,0,3,1,"… by the Yoruba tribe of Western Nigeria for lowering blood pressure (Adewole et al., 2011; Ayinde et al., 2007) … Samples were authenticated at Centre for Research and Development (CERAD), The Federal University of Technology, Akure, Nigeria …","",""
0,"R Ravi, G Abraham, R Ravi, M Mathews…","Early detection of renal disease among truck drivers through organized screening",2020,"Journal of Family …","ncbi.nlm.nih.gov","https://www.ncbi.nlm.nih.gov/pmc/articles/PMC7652140/","",349,"2021-07-31 07:13:36","HTML","","","",,,,,0,0.00,0,5,1,"… High prevalence of diabetes and impaired glucose tolerance in India: National urban diabetes survey … EN, Chukwuonye II, Anyabolu AE, Enwere O. A look at risk factors of albuminuria in subjects without impaired renal filtration function in a general population of Owerri, Nigeria …","https://www.ncbi.nlm.nih.gov/pmc/articles/PMC7652140/","https://scholar.google.com/scholar?q=related:vyEW4M38JfcJ:scholar.google.com/&scioq=%22impaired+glucose+tolerance%22+nigeria&hl=en&as_sdt=0,5&as_ylo=2020&as_yhi=2021&as_vis=1"
8,"G Fleury, A Masís‐Vargas, A Kalsbeek","Metabolic implications of exposure to light at night: lessons from animal and human studies",2020,"Obesity","Wiley Online Library","https://onlinelibrary.wiley.com/doi/abs/10.1002/oby.22807","https://scholar.google.com/scholar?cites=2981695434610212085&as_sdt=2005&sciodt=0,5&hl=en",350,"2021-07-31 07:13:36","","10.1002/oby.22807","","",,,,,8,8.00,3,3,1,"… Rats showed impaired glucose tolerance during an IVGTT when given a 2-hour pulse of green light but not by red or blue light. There was no effect of light of any wavelength on plasma insulin levels during the IVGTT or on basal plasma glucose and insulin levels (78) …","https://onlinelibrary.wiley.com/doi/pdfdirect/10.1002/oby.22807","https://scholar.google.com/scholar?q=related:9XxYODMcYSkJ:scholar.google.com/&scioq=%22impaired+glucose+tolerance%22+nigeria&hl=en&as_sdt=0,5&as_ylo=2020&as_yhi=2021&as_vis=1"
1,"C Ngaruiya, R Bernstein, R Leff, L Wallace, P Agrawal…","Systematic review on chronic non-communicable disease in disaster settings",2020,"medRxiv","medrxiv.org","https://www.medrxiv.org/content/10.1101/2020.10.15.20213025v1.abstract","https://scholar.google.com/scholar?cites=10244590456942581038&as_sdt=2005&sciodt=0,5&hl=en",351,"2021-07-31 07:13:36","","10.1101/2020.10.15.20213025v1.abstract","","",,,,,1,1.00,0,6,1,"… Hult et al. (40) examined the accumulated risk for glucose intolerance 40 years following fetal exposure to famine in Biafra, Nigeria during the Nigerian civil war. The crude odds ratios for both impaired glucose tolerance and diabetes diagnoses were significantly higher for the …","https://www.medrxiv.org/content/medrxiv/early/2020/10/20/2020.10.15.20213025.full.pdf","https://scholar.google.com/scholar?q=related:LlVrD74YLI4J:scholar.google.com/&scioq=%22impaired+glucose+tolerance%22+nigeria&hl=en&as_sdt=0,5&as_ylo=2020&as_yhi=2021&as_vis=1"
1,"K Lu, H Lin","Effect of berberine on hyperandrogenemia, ovulation dysfunction and inflammation in a mouse model of polycystic ovary syndrome",2020,"Tropical Journal of Pharmaceutical Research","ajol.info","https://www.ajol.info/index.php/tjpr/article/view/201785","https://scholar.google.com/scholar?cites=3567496288764885861&as_sdt=2005&sciodt=0,5&hl=en",352,"2021-07-31 07:13:36","","","","",,,,,1,1.00,1,2,1,"… ISSN: 1596-5996 (print); 1596-9827 (electronic) © Pharmacotherapy Group, Faculty of Pharmacy, University of Benin, Benin City, 300001 Nigeria … Obesity increases the risk of infertility and significantly enhances impaired glucose tolerance and the risk of type 2 diabetes which …","https://www.ajol.info/index.php/tjpr/article/download/201785/190288","https://scholar.google.com/scholar?q=related:ZftaJflKgjEJ:scholar.google.com/&scioq=%22impaired+glucose+tolerance%22+nigeria&hl=en&as_sdt=0,5&as_ylo=2020&as_yhi=2021&as_vis=1"
0,"SS WALVEKAR, JG AMBEKAR…","Occupational Stress and Metabolic Syndrome among Bus Drivers: Risk Factors for Cardiovascular Diseases.",2021,"Journal of Clinical & …","search.ebscohost.com","http://search.ebscohost.com/login.aspx?direct=true&profile=ehost&scope=site&authtype=crawler&jrnl=0973709X&AN=150785461&h=RWOP0siTkGEsxazGXpScJNwUPb44TYHWZZMnqmldY5j5VrK3JE2QiB7OxjDHPtbhTnGhzLIa5ZVvEF0QCkwedg%3D%3D&crl=c","",353,"2021-07-31 07:13:36","","","","",,,,,0,0.00,0,3,1,"… Metabolic syndrome is a combination of various disorders such as obesity, high blood pressure, impaired glucose tolerance, and dyslipidemia [1]. In addition to these risk factors, familial history, smoking, physical inactivity, and alcohol consumption are known risk factors for CVD …","",""
0,"MAM Abdalla","The clinical characteristics, presentation, and treatment outcomes of prolactinomas at Groote Schuur Hospital",2021,"","137.158.155.148","http://137.158.155.148/handle/11427/33620","",354,"2021-07-31 07:13:36","","","","",,,,,0,0.00,0,1,1,"… Insulin resistance is common among patients with acromegaly, frank diabetes occurs in 10 to 15 % of cases, and impaired glucose tolerance in a further 50 %(25) … A study form Nigeria included 76 patients with infertility secondary to hyperprolactinaemia and …","http://137.158.155.148/bitstream/handle/11427/33620/thesis_hsf_2021_abdalla%20mohamed%20abdalla%20mansour.pdf?sequence=4&isAllowed=y",""
10,"NM Gumede, BW Lembede, RL Brooksbank…","β-Sitosterol Shows Potential to Protect Against the Development of High-Fructose Diet-Induced Metabolic Dysfunction in Female Rats",2020,"Journal of medicinal …","liebertpub.com","https://www.liebertpub.com/doi/abs/10.1089/jmf.2019.0120","https://scholar.google.com/scholar?cites=14958844574239681379&as_sdt=2005&sciodt=0,5&hl=en",355,"2021-07-31 07:13:36","","10.1089/jmf.2019.0120","","",,,,,10,10.00,3,4,1,"… 2014. WHO, Geneva, Switzerland, 2014. Google Scholar; 2. Maruf FA, Aronu U, Chukwuegbu K, Aronu AE: Influence of gender on prevalence of overweight and obesity in Nigerian schoolchildren and adolescents. Tanzan J …","https://www.liebertpub.com/doi/pdfplus/10.1089/jmf.2019.0120","https://scholar.google.com/scholar?q=related:Y-vVieJ9mM8J:scholar.google.com/&scioq=%22impaired+glucose+tolerance%22+nigeria&hl=en&as_sdt=0,5&as_ylo=2020&as_yhi=2021&as_vis=1"
4,"H Ullah, A De Filippis…","Epigenetic regulation by polyphenols in diabetes and related complications",2020,"… Journal of Nutrition …","content.iospress.com","https://content.iospress.com/articles/mediterranean-journal-of-nutrition-and-metabolism/mnm200489","https://scholar.google.com/scholar?cites=2311640612882953750&as_sdt=2005&sciodt=0,5&hl=en",356,"2021-07-31 07:13:36","","","","",,,,,4,4.00,1,3,1,"Page 1. Mediterranean Journal of Nutrition and Metabolism 13 (2020) 289–310 DOI:10.3233/MNM-200489 IOS Press 289 Review Article Epigenetic regulation by polyphenols in diabetes and related complications Hammad …","","https://scholar.google.com/scholar?q=related:FjZBy-OYFCAJ:scholar.google.com/&scioq=%22impaired+glucose+tolerance%22+nigeria&hl=en&as_sdt=0,5&as_ylo=2020&as_yhi=2021&as_vis=1"
0,"RD Bhalke, MA Giri, YS Lodha, AS More, PS Dange","International Journal of Modern Pharmaceutical Research",,"ijmpronline.com","","https://ijmpronline.com/download/article/418/1620032315.pdf","",357,"2021-07-31 07:13:36","PDF","","","",,,,,0,0.00,0,5,,"… Insulin resistance and hyperinsulinemia eventually lead to impaired glucose tolerance, Except for maturity-onset diabetes of the young (MODY), the mode of inheritance for type 2 diabetes mellitus is unclear … It is a native of southeastern Nigeria …","https://ijmpronline.com/download/article/418/1620032315.pdf","https://scholar.google.com/scholar?q=related:YpJ6Q_h6YJQJ:scholar.google.com/&scioq=%22impaired+glucose+tolerance%22+nigeria&hl=en&as_sdt=0,5&as_ylo=2020&as_yhi=2021&as_vis=1"
0,"KN Hashim, KY Chin, F Ahmad","The Mechanism of Honey in Reversing Metabolic Syndrome",2021,"Molecules","mdpi.com","https://www.mdpi.com/986266","",358,"2021-07-31 07:13:36","","","","",,,,,0,0.00,0,3,1,"Metabolic syndrome is a constellation of five risk factors comprising central obesity, hyperglycaemia, dyslipidaemia, and hypertension, which predispose a person to cardiometabolic diseases. Many studies reported the beneficial effects of honey in reversing metabolic syndrome …","https://www.mdpi.com/1420-3049/26/4/808/pdf","https://scholar.google.com/scholar?q=related:Vp3KTjQ4e0kJ:scholar.google.com/&scioq=%22impaired+glucose+tolerance%22+nigeria&hl=en&as_sdt=0,5&as_ylo=2020&as_yhi=2021&as_vis=1"
0,"HY Hussain","Baseline Assessment of Adult Cohorts Cardiovascular and Metabolic Risk Factors at Community Setting, From Temporal Time Trend to Long-Term Burdens, an …",2020,"Journal of Infectious Diseases & Case …","onlinescientificresearch.com","https://www.onlinescientificresearch.com/articles/baseline-assessment-of-adult-cohorts-cardiovascular-and-metabolic-risk-factors-at-community-setting-from-temporal-time-trend-to-lo.pdf","",359,"2021-07-31 07:13:36","PDF","","","",,,,,0,0.00,0,1,1,"… as central obesity, hyperlipidemia (hypertriglyceridemia and low levels of high-density lipoprotein cholesterol (HDL-C), impaired glucose tolerance and elevated … (2010) A prevalence of cardiometabolic risk factors among a rural Yoruba south-western Nigerian population: a …","https://www.onlinescientificresearch.com/articles/baseline-assessment-of-adult-cohorts-cardiovascular-and-metabolic-risk-factors-at-community-setting-from-temporal-time-trend-to-lo.pdf","https://scholar.google.com/scholar?q=related:wAQNtLbMCnwJ:scholar.google.com/&scioq=%22impaired+glucose+tolerance%22+nigeria&hl=en&as_sdt=0,5&as_ylo=2020&as_yhi=2021&as_vis=1"
0,"FS Sarfo, O Akpa, B Ovbiagele, A Akpalu…","Influence of age on links between major modifiable risk factors and stroke occurrence in West Africa",2021,"Journal of the …","Elsevier","https://www.sciencedirect.com/science/article/pii/S0022510X21002677","",360,"2021-07-31 07:13:36","","","","",,,,,0,0.00,0,5,1,"… The SIREN study is a multicenter case-control study involving 15 medical centers in Ghana and Nigeria … in plasma glucose [8]. Euglycemia/normo-glycemia was defined as HBA1c <5.7% or Fasting blood glucose <5.6 mmol/l; Pre-diabetes/impaired glucose tolerance: HBA1c 5.7 …","",""
2,"AM Nalado, G Olorunfemi, T Dix-Peek, C Dickens…","Hepcidin and GDF-15 are potential biomarkers of iron deficiency anaemia in chronic kidney disease patients in South Africa",2020,"BMC nephrology","Springer","https://link.springer.com/article/10.1186/s12882-020-02046-7","https://scholar.google.com/scholar?cites=8280969828906464448&as_sdt=2005&sciodt=0,5&hl=en",361,"2021-07-31 07:13:36","HTML","10.1186/s12882-020-02046-7","","",,,,,2,2.00,0,5,1,"Anaemia is a common presenting feature among patients with chronic kidney disease (CKD) and it is associated with poor clinical outcomes and quality of life. It is not clear if growth differentiation factor-15 (GDF-15) or hepcidin are useful as early markers of iron deficiency …","https://link.springer.com/article/10.1186/s12882-020-02046-7","https://scholar.google.com/scholar?q=related:wHSyVy_q63IJ:scholar.google.com/&scioq=%22impaired+glucose+tolerance%22+nigeria&hl=en&as_sdt=0,5&as_ylo=2020&as_yhi=2021&as_vis=1"
0,"SY Eisa, KY Ahmed, WE El Sayed","The relationship between Helicobacter pylori infection and control of type 2 diabetes mellitus",2020,"The Scientific Journal of Al-Azhar …","sjamf.eg.net","https://www.sjamf.eg.net/article.asp?issn=1110-2381;year=2020;volume=4;issue=3;spage=388;epage=393;aulast=Eisa","",362,"2021-07-31 07:13:36","HTML","","","",,,,,0,0.00,0,3,1,"… associated with HbA1c levels through a large-scale cross-sectional analysis, which indicated a role of H. pylori in impaired glucose tolerance in adults … O. Prevalence of a marker of active Helicobacter pylori infection among patients with type 2 diabetes mellitus in Lagos, Nigeria …","https://www.sjamf.eg.net/article.asp?issn=1110-2381;year=2020;volume=4;issue=3;spage=388;epage=393;aulast=Eisa","https://scholar.google.com/scholar?q=related:UrZQycOVRpAJ:scholar.google.com/&scioq=%22impaired+glucose+tolerance%22+nigeria&hl=en&as_sdt=0,5&as_ylo=2020&as_yhi=2021&as_vis=1"
0,"AA AbdelAal, AM Abdelnabi","Study of Subclinical Atherosclerosis in Patients with Type 2 Diabetes Mellitus",2021,"The Egyptian Journal of Hospital …","journals.ekb.eg","https://journals.ekb.eg/article_162850.html","",363,"2021-07-31 07:13:36","","","","",,,,,0,0.00,0,2,1,"… Media Thickness in Patients with Diabetes Mellitus Attending Tertiary Care Hospital in Nigeria … Thickness as a measure of cardiovascular disease Burden in Nigerian Africans with … thickness in patients with Type 2 diabetes mellitus and impaired glucose tolerance: a systematic …","https://journals.ekb.eg/article_162850_f521f0e7a2da89eb4aeaa7a8211520f7.pdf","https://scholar.google.com/scholar?q=related:x4YLEIJL2QkJ:scholar.google.com/&scioq=%22impaired+glucose+tolerance%22+nigeria&hl=en&as_sdt=0,5&as_ylo=2020&as_yhi=2021&as_vis=1"
1,"NE Noviani, I Kandarina, FZ Nisa","Houesehold food security is a risk factor of type 2 diabetic mellitus",2020,"","digilib2.unisayogya.ac.id","http://digilib2.unisayogya.ac.id/xmlui/bitstream/handle/123456789/2769/1131-5031-1-PB.pdf?sequence=1","https://scholar.google.com/scholar?cites=4138572201450091691&as_sdt=2005&sciodt=0,5&hl=en",364,"2021-07-31 07:13:36","PDF","","","",,,,,1,1.00,0,3,1,"… Gender and age specific prevalence and associated risk factors of type 2 diabetes mellitus in Uyo metropolis, South Eastern Nigeria. Diabetol Croat. 2012;41(1):17–28 … Jauch-Chara K, Schmoller A, Oltmanns KM. Impaired glucose tolerance in healthy men with low body weight …","http://digilib2.unisayogya.ac.id/xmlui/bitstream/handle/123456789/2769/1131-5031-1-PB.pdf?sequence=1","https://scholar.google.com/scholar?q=related:qzS9eH0pbzkJ:scholar.google.com/&scioq=%22impaired+glucose+tolerance%22+nigeria&hl=en&as_sdt=0,5&as_ylo=2020&as_yhi=2021&as_vis=1"
0,"CE Fuentes-Venado, G Terán-Pérez…","Nutritional Status Influences Oxidative Stress and Insulin Resistance in Preschool Children",2021,"Metabolic Syndrome …","liebertpub.com","https://www.liebertpub.com/doi/abs/10.1089/met.2021.0021","",365,"2021-07-31 07:13:36","","10.1089/met.2021.0021","","",,,,,0,0.00,0,3,1,"Background: Child malnutrition represents a major public health problem with physiological, psychological, and social short- and long-term implications. Objective: To compare the influence of nutri...","",""
0,"F Sarvghadi, MR Beyranvand, H Emami","The Relationship between QT Interval Indices with Cardiac Autonomic Neuropathy in Diabetic Patients",2020,"","scholar.archive.org","https://scholar.archive.org/work/x2npqfi4fbcgpbfljpuvewzcam/access/wayback/https://assets.researchsquare.com/files/rs-47922/v1/42bcd28a-514a-4415-af26-5c98835b07ed.pdf","",366,"2021-07-31 07:13:36","PDF","","","",,,,,0,0.00,0,3,1,"… Its prevalence range from 12% in black patients of Nigeria 9, 17.1% in yellow race of China 18 to 44.1% in Caucasian patients from Serbia 16. Large … Patients with Impaired Glucose Tolerance. Front Endocrinol (Lausanne). 2017 Jun 13;8:129. doi: 10.3389/fendo.2017.00129 24 …","https://scholar.archive.org/work/x2npqfi4fbcgpbfljpuvewzcam/access/wayback/https://assets.researchsquare.com/files/rs-47922/v1/42bcd28a-514a-4415-af26-5c98835b07ed.pdf",""
