Cites,Authors,Title,Year,Source,Publisher,ArticleURL,CitesURL,GSRank,QueryDate,Type,DOI,ISSN,CitationURL,Volume,Issue,StartPage,EndPage,ECC,CitesPerYear,CitesPerAuthor,AuthorCount,Age,Abstract,FullTextURL,RelatedURL
89,"A Parveen, B Parveen, R Parveen, ...","Challenges and guidelines for clinical trial of herbal drugs",2015,"Journal of pharmacy & …","ncbi.nlm.nih.gov","https://www.ncbi.nlm.nih.gov/pmc/articles/pmc4678978/","https://scholar.google.com/scholar?cites=10164262844340183562&as_sdt=2005&sciodt=0,5&hl=en",158,"2021-07-31 04:58:08","HTML","","","",,,,,89,14.83,22,4,6,"… [Google Scholar]. 3. Kumar K. USA: Howard University, USA in Collaboration with NIPRD, Abuja, Nigeria, and Xechem … Chinese herbal medicine Tianqi reduces progression from impaired glucose tolerance to diabetes: A double-blind, randomized, placebo-controlled …","https://www.ncbi.nlm.nih.gov/pmc/articles/pmc4678978/","https://scholar.google.com/scholar?q=related:CiKZUDS3Do0J:scholar.google.com/&scioq=%22impaired+glucose+tolerance%22+nigeria&hl=en&as_sdt=0,5&as_ylo=2015&as_yhi=2015&as_vis=1"
3,"HD Akpan, I Ekaidem","Modulation of Immunological and Hematological Disturbances of Diabetes Mellitus by Diets Containing Combined Leaves of Vernonia amygdalina and …",2015,"British Journal of Applied Science & …","researchgate.net","https://www.researchgate.net/profile/Henry-Akpan/publication/273347187_Modulation_of_Immunological_and_Hematological_Disturbances_of_Diabetes_Mellitus_by_Diets_Containing_Combined_Leaves_of_Vernonia_amygdalina_and_Gongronema_latifolium/links/5712be2c08aeff315ba0d91a/Modulation-of-Immunological-and-Hematological-Disturbances-of-Diabetes-Mellitus-by-Diets-Containing-Combined-Leaves-of-Vernonia-amygdalina-and-Gongronema-latifolium.pdf","https://scholar.google.com/scholar?cites=9723444175122989555&as_sdt=2005&sciodt=0,5&hl=en",159,"2021-07-31 04:58:08","PDF","","","",,,,,3,0.50,2,2,6,"… Medical Sciences, University of Uyo, Uyo, Nigeria, 2Department of Chemical Pathology, Faculty of Clinical Sciences, University of Uyo, Uyo, Nigeria … An elevated WBC count is present in impaired glucose tolerance (IGF) [21] and is associated with macro- and micro angiopathic …","https://www.researchgate.net/profile/Henry-Akpan/publication/273347187_Modulation_of_Immunological_and_Hematological_Disturbances_of_Diabetes_Mellitus_by_Diets_Containing_Combined_Leaves_of_Vernonia_amygdalina_and_Gongronema_latifolium/links/5712be2c08aeff315ba0d91a/Modulation-of-Immunological-and-Hematological-Disturbances-of-Diabetes-Mellitus-by-Diets-Containing-Combined-Leaves-of-Vernonia-amygdalina-and-Gongronema-latifolium.pdf","https://scholar.google.com/scholar?q=related:8wGM0_Wc8IYJ:scholar.google.com/&scioq=%22impaired+glucose+tolerance%22+nigeria&hl=en&as_sdt=0,5&as_ylo=2015&as_yhi=2015&as_vis=1"
42,"J Nakibuuka, M Sajatovic, J Nankabirwa, ...","Early mortality and functional outcome after acute stroke in Uganda: prospective study with 30 day follow-up",2015,"…","springerplus.springeropen.com","https://springerplus.springeropen.com/articles/10.1186/s40064-015-1252-8","https://scholar.google.com/scholar?cites=12022124650277641113&as_sdt=2005&sciodt=0,5&hl=en",160,"2021-07-31 04:58:08","HTML","10.1186/s40064-015-1252-8","","",,,,,42,7.00,11,4,6,"Identification of early outcomes post stroke and their predictors is important in stroke management strategies. We prospectively analysed 30-day outcomes (mortality and functional ability) after stroke and their predictors among patients admitted within 7 days post event to a national …","https://springerplus.springeropen.com/articles/10.1186/s40064-015-1252-8","https://scholar.google.com/scholar?q=related:mRtEaawq16YJ:scholar.google.com/&scioq=%22impaired+glucose+tolerance%22+nigeria&hl=en&as_sdt=0,5&as_ylo=2015&as_yhi=2015&as_vis=1"
8,"EG Sylvester, EU Israel, ...","The effect of Gongronema latifolium leaf extract on blood biochemical assay in diabetic rats",2015,"Journal of scientific …","journaljsrr.com","https://journaljsrr.com/index.php/JSRR/article/view/21695","https://scholar.google.com/scholar?cites=14431449717373368312&as_sdt=2005&sciodt=0,5&hl=en",161,"2021-07-31 04:58:08","","","","",,,,,8,1.33,3,3,6,"… diabetes prevalence in the African Region (13.1%). Nigeria also has the highest number of people with impaired glucose tolerance with an estimated 3, 85 million people [2]. Gongronema latifolium Benth Hook, (Asclepiadaceae) is …","https://journaljsrr.com/index.php/JSRR/article/download/21695/40297","https://scholar.google.com/scholar?q=related:-HfzjQ7PRsgJ:scholar.google.com/&scioq=%22impaired+glucose+tolerance%22+nigeria&hl=en&as_sdt=0,5&as_ylo=2015&as_yhi=2015&as_vis=1"
3,"S Mukherjee","Prevalence of thyroid dysfunction in young patients with type 2 diabetes mellitus in Eastern India, study of 120 cases from a tertiary care hospital",2015,"Journal of the ASEAN Federation of …","asean-endocrinejournal.org","http://www.asean-endocrinejournal.org/index.php/JAFES/article/view/227","https://scholar.google.com/scholar?cites=9343422355613670601&as_sdt=2005&sciodt=0,5&hl=en",162,"2021-07-31 04:58:08","","","","",,,,,3,0.50,3,1,6,"… 7. Ramachandran A, Snehalatha C, Kapur A, Vijay V, Mohan V, Das AK, et al. High prevalence of diabetes and impaired glucose tolerance in India: National Urban Diabetes Survey … Evaluation of thyroid function in diabetes Mellitus in Calabar, Nigeria. Indian J Clin Biochem …","https://www.asean-endocrinejournal.org/index.php/JAFES/article/download/227/690/","https://scholar.google.com/scholar?q=related:ydzL_CCBqoEJ:scholar.google.com/&scioq=%22impaired+glucose+tolerance%22+nigeria&hl=en&as_sdt=0,5&as_ylo=2015&as_yhi=2015&as_vis=1"
1,"SS Sunwiale","Prevalence of Prediabetes and Diabetes Mellitus among Children and Young Adults in the Kassena Nankana District of Ghana",2015,"","ir.knust.edu.gh","http://ir.knust.edu.gh/handle/123456789/6971","https://scholar.google.com/scholar?cites=743346951081373516&as_sdt=2005&sciodt=0,5&hl=en",163,"2021-07-31 04:58:08","","","","",,,,,1,0.17,1,1,6,"… IFG: Impaired fasting glycaemia IGT: Impaired glucose tolerance INS: Insulin gene … The transition from the early metabolic abnormalities that precede diabetes, impaired fasting glucose (IFG) and impaired glucose tolerance (IGT), to diabetes may take many …","http://ir.knust.edu.gh/bitstream/123456789/6971/1/SAMUEL%20SUNYAZI%20SUNWIALE.pdf","https://scholar.google.com/scholar?q=related:TC8TFB3mUAoJ:scholar.google.com/&scioq=%22impaired+glucose+tolerance%22+nigeria&hl=en&as_sdt=0,5&as_ylo=2015&as_yhi=2015&as_vis=1"
0,"D Rungta","Research & Reviews: Journal of Medical and Health Sciences",,"Citeseer","","http://citeseerx.ist.psu.edu/viewdoc/download?doi=10.1.1.1078.8486&rep=rep1&type=pdf","",164,"2021-07-31 04:58:08","PDF","","","",,,,,0,0.00,0,1,,"… Fifty five% and in a sanatorium survey in 2008, it was once determined to be 21.6% with GDM and impaired glucose tolerance combined … 2155-6156.1000526 9. Okafor UH, Ezeala A, Aneke E (2015) Audit of Screening for Diabetic Nephropathy in a Teaching Hospital in Nigeria …","http://citeseerx.ist.psu.edu/viewdoc/download?doi=10.1.1.1078.8486&rep=rep1&type=pdf","https://scholar.google.com/scholar?q=related:JnP-HBeuVb4J:scholar.google.com/&scioq=%22impaired+glucose+tolerance%22+nigeria&hl=en&as_sdt=0,5&as_ylo=2015&as_yhi=2015&as_vis=1"
1,"F Benavides, N Grossman, H Poggi, E Nieto, A Bertran, ...","Effect of VKORC1 and CYP2C9 variants on dosage of oral anticoagulants in Chilean individuals",2015,"","repositorio.uc.cl","https://repositorio.uc.cl/xmlui/bitstream/handle/11534/59452/Effect%20of%20VKORC1%20and%20CYP2C9%20variants%20on%20dosage%20of%20oral%20anticoagulants%20in%20Chilean%20individuals..pdf?sequence=1","https://scholar.google.com/scholar?cites=4998586341835425064&as_sdt=2005&sciodt=0,5&hl=en",165,"2021-07-31 04:58:08","PDF","","","",,,,,1,0.17,0,6,6,"Page 1. 624 www.thelancet.com/diabetes-endocrinology Vol 3 August 2015 Articles Lancet Diabetes Endocrinol 2015; 3: 624–37 Published Online June 22, 2015 http://dx.doi.org/10.1016/ S2213-8587(15)00129-1 See Comment …","https://repositorio.uc.cl/xmlui/bitstream/handle/11534/59452/Effect%20of%20VKORC1%20and%20CYP2C9%20variants%20on%20dosage%20of%20oral%20anticoagulants%20in%20Chilean%20individuals..pdf?sequence=1","https://scholar.google.com/scholar?q=related:KEU4VMuLXkUJ:scholar.google.com/&scioq=%22impaired+glucose+tolerance%22+nigeria&hl=en&as_sdt=0,5&as_ylo=2015&as_yhi=2015&as_vis=1"
0,"AN Onyiriuka, CA Oguejiofor, WE Sadoh","LOW BIRTHWEIGHT, RAPID WEIGHT GAIN AND METABOLIC SYNDROME IN ADOLESCENCE: AN ILLUSTRATIVE CASE REPORT",2015,"Romanian Journal of …","rjdnmd.org","http://rjdnmd.org/index.php/RJDNMD/article/view/116","",166,"2021-07-31 04:58:08","","","","",,,,,0,0.00,0,3,6,"… Chen et al [12], have observed that data regarding MetS in children is limited, especially in developing countries (Nigeria inclusive) … 7. Phipps K, Barker DJ, Hales CN, Fall CN, Osmond C, Clark PM. Fetal growth and impaired glucose tolerance in men and women …","http://rjdnmd.org/index.php/RJDNMD/article/download/116/94","https://scholar.google.com/scholar?q=related:kF8_skjuu3YJ:scholar.google.com/&scioq=%22impaired+glucose+tolerance%22+nigeria&hl=en&as_sdt=0,5&as_ylo=2015&as_yhi=2015&as_vis=1"
15,"L Chen, YT Peng, FL Chen, TH Tung","Epidemiology, management, and economic evaluation of screening of gallstone disease among type 2 diabetics: A systematic review",2015,"World Journal of Clinical …","ncbi.nlm.nih.gov","https://www.ncbi.nlm.nih.gov/pmc/articles/PMC4517334/","https://scholar.google.com/scholar?cites=15347773254985403481&as_sdt=2005&sciodt=0,5&hl=en",167,"2021-07-31 04:58:08","HTML","","","",,,,,15,2.50,4,4,6,"… et al[10], 2013, 400, Ibadan, Nigeria, 17.5%, Age, BMI, DM, duration of the disease. Yilmaz et al[36], 2014, 441, Turkey, 12.2%, Age, BMI, Gender, metabolic syndrome. Shen et al[37], 2014, 6511, Taiwan, 13.2%, Age, Gender, metabolic syndrome. Ibitoye et al[38], 2014, 1283, Nigerian …","https://www.ncbi.nlm.nih.gov/pmc/articles/PMC4517334/","https://scholar.google.com/scholar?q=related:WUylnHU-_tQJ:scholar.google.com/&scioq=%22impaired+glucose+tolerance%22+nigeria&hl=en&as_sdt=0,5&as_ylo=2015&as_yhi=2015&as_vis=1"
0,"J LAWAL","EVALUATION OF THYROID DYSFUNCTION IN TYPE 2 DIABETIC PATIENTS IN SOKOTO METROPOLIS",2015,"","oer.udusok.edu.ng","http://oer.udusok.edu.ng/xmlui/handle/123456789/676","",168,"2021-07-31 04:58:08","","","","",,,,,0,0.00,0,1,6,"… studied a mixed population of diabetic Nigerians in Calabar.Therefore, there is … 2.0 LITERATURE REVIEW DiabetesMellitus (DM) (locally called in Nigeria as in Hausa language ciwonsuga) … 7 considered to have impaired glucose tolerance of these two prediabetic states …","http://oer.udusok.edu.ng/xmlui/bitstream/handle/123456789/676/EVALUATION%20OF%20THYROID%20DYSFUNCTION%20IN%20TYPE%202DIABETIC%20PATIENTS%20IN%20SOKOTO%20METROPOLIS.pdf?sequence=1&isAllowed=y","https://scholar.google.com/scholar?q=related:yaKkdMgT2U8J:scholar.google.com/&scioq=%22impaired+glucose+tolerance%22+nigeria&hl=en&as_sdt=0,5&as_ylo=2015&as_yhi=2015&as_vis=1"
13,"YA Abdirahman, KK Juma, WA Makori, ...","Blood glucose lowering effect and safety of the aqueous leaf extracts of Zanha africana",2015,"Pharmaceutica …","ir-library.ku.ac.ke","http://ir-library.ku.ac.ke/bitstream/handle/123456789/13796/Blood%20glucose%20lowering%20effect%20and%20safety....pdf?sequence=1","https://scholar.google.com/scholar?cites=13072048986244140337&as_sdt=2005&sciodt=0,5&hl=en",169,"2021-07-31 04:58:08","PDF","","","",,,,,13,2.17,3,4,6,"… It was demonstrated that 4 weeks dietary Mg supplementation improved insulin secretory capacity [39]. Studies on guinea pigs showed that manganese deficiency caused impaired glucose tolerance and this was corrected by manganese supplementation [40] …","http://ir-library.ku.ac.ke/bitstream/handle/123456789/13796/Blood%20glucose%20lowering%20effect%20and%20safety....pdf?sequence=1","https://scholar.google.com/scholar?q=related:MU2WV0s_abUJ:scholar.google.com/&scioq=%22impaired+glucose+tolerance%22+nigeria&hl=en&as_sdt=0,5&as_ylo=2015&as_yhi=2015&as_vis=1"
0,"DRIL ABUBAKAR, EO OLUSHOLA, AY ABDULKADIR","PHYSICAL FITNESS COMPONENTS AS PARAMETER FOR THE TREATMENT OF THE MENTALLY AND SOCIALLY CHALLENGED PEOPLE",,"globalacademicgroup.com","","https://www.globalacademicgroup.com/journals/pristine/DR%20%20IBRAHIM.pdf","",170,"2021-07-31 04:58:08","PDF","","","",,,,,0,0.00,0,3,,"… Prospective data in patients with impaired glucose tolerance reveled that central adiposity, having a strong correlation with insulin resistance, better predicted future type 2 DM than BMI … The British Journal of Psychiatry Federal Government of Nigeria FGN/UBE2010. Pg …","https://www.globalacademicgroup.com/journals/pristine/DR%20%20IBRAHIM.pdf","https://scholar.google.com/scholar?q=related:4O3XJaCRMzcJ:scholar.google.com/&scioq=%22impaired+glucose+tolerance%22+nigeria&hl=en&as_sdt=0,5&as_ylo=2015&as_yhi=2015&as_vis=1"
6,"J Kaur, S Singh, K Kaur","Prevalence and associated comorbidities of body mass index ranges",2015,"International Journal of Medicine","researchgate.net","https://www.researchgate.net/profile/Jaspinder-Kaur-2/publication/273448362_Prevalence_and_associated_comorbidities_of_body_mass_index_ranges/links/5501c3600cf231de076b7945/Prevalence-and-associated-comorbidities-of-body-mass-index-ranges.pdf","https://scholar.google.com/scholar?cites=5324477557758143310&as_sdt=2005&sciodt=0,5&hl=en",171,"2021-07-31 04:58:08","PDF","","","",,,,,6,1.00,2,3,6,"… those previously diagnosed with high cholesterol, impaired fasting glucose (IFG), impaired glucose tolerance (IGT) or … High Prevalence of Obesity among Indigenous Residents of a Nigerian Ethnic Group: The Kalabaris in the Niger Delta Region of South-South Nigeria …","https://www.researchgate.net/profile/Jaspinder-Kaur-2/publication/273448362_Prevalence_and_associated_comorbidities_of_body_mass_index_ranges/links/5501c3600cf231de076b7945/Prevalence-and-associated-comorbidities-of-body-mass-index-ranges.pdf","https://scholar.google.com/scholar?q=related:Tqu25CBY5EkJ:scholar.google.com/&scioq=%22impaired+glucose+tolerance%22+nigeria&hl=en&as_sdt=0,5&as_ylo=2015&as_yhi=2015&as_vis=1"
43,"G Garcia-Garcia, V Jha, PK Tao Li, ...","Chronic kidney disease (CKD) in disadvantaged populations",2015,"Clinical kidney …","academic.oup.com","https://academic.oup.com/ckj/article-abstract/8/1/3/434867","https://scholar.google.com/scholar?cites=7776126146073291464&as_sdt=2005&sciodt=0,5&hl=en",172,"2021-07-31 04:58:08","","","","",,,,,43,7.17,11,4,6,"Abstract. Twelve March 2015 will mark the 10th anniversary of World Kidney Day (WKD), an initiative of the International Society of Nephrology and the Internati.","https://academic.oup.com/ckj/article/8/1/3/434867","https://scholar.google.com/scholar?q=related:yGpTuYdZ6msJ:scholar.google.com/&scioq=%22impaired+glucose+tolerance%22+nigeria&hl=en&as_sdt=0,5&as_ylo=2015&as_yhi=2015&as_vis=1"
51,"HL Blackmore, SE Ozanne","Programming of cardiovascular disease across the life-course",2015,"Journal of molecular and cellular cardiology","Elsevier","https://www.sciencedirect.com/science/article/pii/S0022282814004027","https://scholar.google.com/scholar?cites=17806908740800190550&as_sdt=2005&sciodt=0,5&hl=en",173,"2021-07-31 04:58:08","","","","",,,,,51,8.50,26,2,6,"","https://www.repository.cam.ac.uk/bitstream/handle/1810/247183/Blackmore_Ozanne-2015-Journal_of_Molecular_and_Cellular_Cardiology.pdf?sequence=1","https://scholar.google.com/scholar?q=related:VpgxmyfZHvcJ:scholar.google.com/&scioq=%22impaired+glucose+tolerance%22+nigeria&hl=en&as_sdt=0,5&as_ylo=2015&as_yhi=2015&as_vis=1"
0,"R Khawaja, T Munir, U Hassan, ...","TYPE 2 DIABETES MELLITUS",2015,"The Professional Medical …","theprofesional.com","http://www.theprofesional.com/index.php/tpmj/article/download/1424/1137","",174,"2021-07-31 04:58:08","PDF","","","",,,,,0,0.00,0,4,6,"… an increased production of reactive oxygen species (ROS).The oxidative stress, through ROS, has been proposed as the root cause of insulin resistance, β-cell dysfunction, impaired glucose tolerance, type 2 … Antioxidant status of type 2 diabetic patients in Port Harcourt, Nigeria …","http://www.theprofesional.com/index.php/tpmj/article/download/1424/1137","https://scholar.google.com/scholar?q=related:jIw606z4NlYJ:scholar.google.com/&scioq=%22impaired+glucose+tolerance%22+nigeria&hl=en&as_sdt=0,5&as_ylo=2015&as_yhi=2015&as_vis=1"
55,"M Al-Biltagi, OARE Tolba, MA Rowisha, ...","Speckle tracking and myocardial tissue imaging in infant of diabetic mother with gestational and pregestational diabetes",2015,"Pediatric …","Springer","https://link.springer.com/article/10.1007/s00246-014-1033-0","https://scholar.google.com/scholar?cites=15156326545761908964&as_sdt=2005&sciodt=0,5&hl=en",175,"2021-07-31 04:58:08","","10.1007/s00246-014-1033-0","","",,,,,55,9.17,14,4,6,"… Diabetes in pregnant women could be either pre-gestational or gestational with an incidence of impaired glucose tolerance in pregnancy ranging between 3 and 10 %; which varies according to the average incidence of diabetes in the general population [20] …","","https://scholar.google.com/scholar?q=related:5Dj2E7EWVtIJ:scholar.google.com/&scioq=%22impaired+glucose+tolerance%22+nigeria&hl=en&as_sdt=0,5&as_ylo=2015&as_yhi=2015&as_vis=1"
10,"SR Jain, KH Shah, HN Acharya, K Barot, ...","Prevalence and predictors of metabolic syndrome in young asymptomatic Gujarati population",2015,"International journal of …","hindawi.com","https://www.hindawi.com/journals/ijcd/2015/365217/","https://scholar.google.com/scholar?cites=9773290461821868139&as_sdt=2005&sciodt=0,5&hl=en",176,"2021-07-31 04:58:08","HTML","","","",,,,,10,1.67,2,5,6,"… This pattern of lipid abnormality was documented in a recent Nigerian study [14 … [9] R. Sinha, G. Fisch, B. Teague et al., “Prevalence of impaired glucose tolerance among children … and determinants of the metabolic syndrome in apparently healthy adult Nigerians,” Tropical Doctor …","https://www.hindawi.com/journals/ijcd/2015/365217/","https://scholar.google.com/scholar?q=related:axib1-SzoYcJ:scholar.google.com/&scioq=%22impaired+glucose+tolerance%22+nigeria&hl=en&as_sdt=0,5&as_ylo=2015&as_yhi=2015&as_vis=1"
1,"M Shinde, A Joshi, V Arutagi, D Singh, ...","Visual dynamic e-module as a tool to fulfill informational needs and care continuum for diabetic patients",2015,"Journal of family …","ncbi.nlm.nih.gov","https://www.ncbi.nlm.nih.gov/pmc/articles/PMC4535084/","https://scholar.google.com/scholar?cites=10724343256861509787&as_sdt=2005&sciodt=0,5&hl=en",177,"2021-07-31 04:58:08","HTML","","","",,,,,1,0.17,0,5,6,"… Prevalence of diabetes and prediabetes (impaired fasting glucose and/or impaired glucose tolerance) in urban … and control by diabetic patients at Federal Medical Centre UmuahiaAbia State, Nigeria … Umar A. Determinants of diabetes knowledge in a cohort of Nigerian diabetics …","https://www.ncbi.nlm.nih.gov/pmc/articles/PMC4535084/","https://scholar.google.com/scholar?q=related:mwiWQl-F1JQJ:scholar.google.com/&scioq=%22impaired+glucose+tolerance%22+nigeria&hl=en&as_sdt=0,5&as_ylo=2015&as_yhi=2015&as_vis=1"
1,"H Wei, X Liang, B Wu, J Zhang, Y Qin, G Luo, ...","Antihyperglycemic and antioxidant activity of Fructus hordei Germinatus extract on streptozotocin-induced diabetic rats",2015,"Tropical Journal of …","ajol.info","https://www.ajol.info/index.php/tjpr/article/view/123670","https://scholar.google.com/scholar?cites=13198368625644236576&as_sdt=2005&sciodt=0,5&hl=en",178,"2021-07-31 04:58:08","","","","",,,,,1,0.17,0,7,6,"… ISSN: 1596-5996 (print); 1596-9827 (electronic) © Pharmacotherapy Group, Faculty of Pharmacy, University of Benin, Benin City, 300001 Nigeria … Oral administration of FHGE 80 mg/kg significantly improved the impaired glucose tolerance in the diabetic rats with change in …","https://www.ajol.info/index.php/tjpr/article/view/123670/113204","https://scholar.google.com/scholar?q=related:IG8vSlYGKrcJ:scholar.google.com/&scioq=%22impaired+glucose+tolerance%22+nigeria&hl=en&as_sdt=0,5&as_ylo=2015&as_yhi=2015&as_vis=1"
19,"B Pang, Q Zhou, TY Zhao, LS He, J Guo, ...","Innovative thoughts on treating diabetes from the perspective of traditional Chinese medicine",2015,"Evidence-Based …","hindawi.com","https://www.hindawi.com/journals/ecam/2015/905432/","https://scholar.google.com/scholar?cites=9240683898618428024&as_sdt=2005&sciodt=0,5&hl=en",179,"2021-07-31 04:58:08","HTML","","","",,,,,19,3.17,3,6,6,"… blood and unblock the collaterals. In the clinical setting, combined therapies of hypoglycemia and Luotong could slow down the progression from impaired glucose tolerance (IGT) to diabetes [42]. Tang-Luo-Ning (TLN, mainly …","https://www.hindawi.com/journals/ecam/2015/905432/","https://scholar.google.com/scholar?q=related:eLrS6guBPYAJ:scholar.google.com/&scioq=%22impaired+glucose+tolerance%22+nigeria&hl=en&as_sdt=0,5&as_ylo=2015&as_yhi=2015&as_vis=1"
25,"S Yu, X Guo, H Yang, L Zheng, Y Sun","Metabolic syndrome in hypertensive adults from rural Northeast China: an update",2015,"BMC public health","Springer","https://link.springer.com/article/10.1186/s12889-015-1587-7","https://scholar.google.com/scholar?cites=14915847676222333395&as_sdt=2005&sciodt=0,5&hl=en",180,"2021-07-31 04:58:08","HTML","10.1186/s12889-015-1587-7","","",,,,,25,4.17,5,5,6,"… Chinese. This was quite different from other countries like Nigeria, India and America. In Nigerian and Indian, visceral obesity and low HDL-C were the other common cardiovascular risk factors among hypertensive subjects [14,15] …","https://link.springer.com/article/10.1186/s12889-015-1587-7","https://scholar.google.com/scholar?q=related:02ERGW-8_84J:scholar.google.com/&scioq=%22impaired+glucose+tolerance%22+nigeria&hl=en&as_sdt=0,5&as_ylo=2015&as_yhi=2015&as_vis=1"
0,"B Buyukaydin, M KISKAC, M ZORLU, M CAKIRCA, ...","Frequency and determinants of erectile dysfunction in Turkish diabetic men",2015,"","openaccess.bezmialem.edu.tr","https://openaccess.bezmialem.edu.tr/handle/20.500.12645/3329","",181,"2021-07-31 04:58:08","","","","",,,,,0,0.00,0,5,6,"… Nigerian Journal of Clinical Practice • Mar-Apr 2015 • Vol 18 • Issue 2 … The Turkish Diabetes Epidemiology Study (TURDEP) reported that the crude prevalence of diabetes was 7.2% and prevalence of impaired glucose tolerance (IGT) was 6.7% among adults over the age of 20 …","https://openaccess.bezmialem.edu.tr/bitstream/handle/20.500.12645/3329/47-10.4103-1119-3077.151043.pdf?sequence=1&isAllowed=y","https://scholar.google.com/scholar?q=related:S9QkLxVHs70J:scholar.google.com/&scioq=%22impaired+glucose+tolerance%22+nigeria&hl=en&as_sdt=0,5&as_ylo=2015&as_yhi=2015&as_vis=1"
273,"A Mancini, E Imperlini, E Nigro, C Montagnese, ...","Biological and nutritional properties of palm oil and palmitic acid: effects on health",2015,"Molecules","mdpi.com","https://www.mdpi.com/112098","https://scholar.google.com/scholar?cites=2380462507273115246&as_sdt=2005&sciodt=0,5&hl=en",182,"2021-07-31 04:58:08","","","","",,,,,273,45.50,55,5,6,"… Large scale palm crops are found across the tropical regions, and Malaysia and Indonesia are the leading producers of PO, accounting for the 86% of global production; other PO producing countries are Nigeria, Thailand, Colombia, Papa Guinea, Cote d'Ivoire, India and Brazil …","https://www.mdpi.com/1420-3049/20/9/17339/pdf","https://scholar.google.com/scholar?q=related:blYmwwkaCSEJ:scholar.google.com/&scioq=%22impaired+glucose+tolerance%22+nigeria&hl=en&as_sdt=0,5&as_ylo=2015&as_yhi=2015&as_vis=1"
36,"MH Fard, G Naseh, N Lotfi, SM Hosseini, ...","Effects of aqueous extract of turnip leaf (Brassica rapa) in alloxan-induced diabetic rats",2015,"Avicenna journal of …","ncbi.nlm.nih.gov","https://www.ncbi.nlm.nih.gov/pmc/articles/PMC4418064/","https://scholar.google.com/scholar?cites=11039113179181395483&as_sdt=2005&sciodt=0,5&hl=en",183,"2021-07-31 04:58:08","HTML","","","",,,,,36,6.00,7,5,6,"… AgrBiol JN Am. 2010;1:130–134. [Google Scholar]; Ezuruike UF, Prieto J. 2014. The use of plants in the traditional management of diabetes in Nigeria: Pharmacological and toxicological considerations. J Ethnopharmacol. M;155:857–924 …","https://www.ncbi.nlm.nih.gov/pmc/articles/PMC4418064/","https://scholar.google.com/scholar?q=related:G65w4PLOMpkJ:scholar.google.com/&scioq=%22impaired+glucose+tolerance%22+nigeria&hl=en&as_sdt=0,5&as_ylo=2015&as_yhi=2015&as_vis=1"
25,"SO Bushara, SK Noor, WM Elmadhoun, ...","Undiagnosed hypertension in a rural community in Sudan and association with some features of the metabolic syndrome: how serious is the situation?",2015,"Renal failure","Taylor & Francis","https://www.tandfonline.com/doi/abs/10.3109/0886022X.2015.1052951","https://scholar.google.com/scholar?cites=17583310674362471753&as_sdt=2005&sciodt=0,5&hl=en",184,"2021-07-31 04:58:08","","10.3109/0886022X.2015.1052951","","",,,,,25,4.17,6,4,6,"… Individuals with RBS between 170 and 199 mg/dL (9.4–11 mmol/L) or FBS between 110 and 125 mg/dL (6.1–6.9 mmol/L) were considered as cases of impaired glucose tolerance (IGT). Blood pressure measurement. Blood …","https://www.tandfonline.com/doi/pdf/10.3109/0886022X.2015.1052951","https://scholar.google.com/scholar?q=related:SZW14OV3BPQJ:scholar.google.com/&scioq=%22impaired+glucose+tolerance%22+nigeria&hl=en&as_sdt=0,5&as_ylo=2015&as_yhi=2015&as_vis=1"
