Cites,Authors,Title,Year,Source,Publisher,ArticleURL,CitesURL,GSRank,QueryDate,Type,DOI,ISSN,CitationURL,Volume,Issue,StartPage,EndPage,ECC,CitesPerYear,CitesPerAuthor,AuthorCount,Age,Abstract,FullTextURL,RelatedURL
46,"CECC Ejike, NK Uka, ...","Diabetes and pre-diabetes in adult Nigerians: Prevalence, and correlations of blood glucose concentrations with measures of obesity",2015,"African Journal of …","academicjournals.org","https://academicjournals.org/journal/AJBR/article-abstract/90DCAF752045","https://scholar.google.com/scholar?cites=14605766791247326487&as_sdt=2005&sciodt=0,5&hl=en",1,"2021-07-31 04:58:08","","","","",,,,,46,7.67,15,3,6,"… disease and BMI-metabolic-risk sub-phenotypes in an adult Nigerian population … A populationbased study of the prevalence of diabetes and impaired glucose tolerance in adults in northern … in Calabar: a cross-sectional observational study among residents of Calabar, Nigeria …","https://academicjournals.org/journal/AJBR/article-full-text-pdf/90DCAF752045","https://scholar.google.com/scholar?q=related:F21-EIMbssoJ:scholar.google.com/&scioq=%22impaired+glucose+tolerance%22+nigeria&hl=en&as_sdt=0,5&as_ylo=2015&as_yhi=2015&as_vis=1"
1,"T Jaja, B Okoh","Oral Glucose Tolerance Test among Adolescents with Impaired Fasting Blood Glucose",2015,"Nigerian Health Journal","ajol.info","https://www.ajol.info/index.php/nhj/article/view/133247","https://scholar.google.com/scholar?cites=5162741909253612072&as_sdt=2005&sciodt=0,5&hl=en",2,"2021-07-31 04:58:08","","","","",,,,,1,0.17,1,2,6,"… significant difference in prevalence of hypertension, overweight/obesity and hypertension in group with or without impaired glucose tolerance … data suggest diabetes is emerging as a major health problem in Africa including Nigeria 1 • This … The Nigerian Health Journal, Vol …","https://www.ajol.info/index.php/nhj/article/view/133247/122857","https://scholar.google.com/scholar?q=related:KGIVwGm-pUcJ:scholar.google.com/&scioq=%22impaired+glucose+tolerance%22+nigeria&hl=en&as_sdt=0,5&as_ylo=2015&as_yhi=2015&as_vis=1"
5,"Q Xiao, LP Wang, ZS Ran, ...","Changes of plasma tumor necrosis factor α and C-reactive protein levels in patients with hypertension accompanied by impaired glucose tolerance and their clinical …",2015,"Asian Pacific Journal of …","koreascience.or.kr","https://www.koreascience.or.kr/article/JAKO201528551641061.page","https://scholar.google.com/scholar?cites=6931887728831388626&as_sdt=2005&sciodt=0,5&hl=en",3,"2021-07-31 04:58:08","","","","",,,,,5,0.83,1,4,6,"… DOI:http://dx.doi.org/10.7314/APJCP.2015.16.8.3389 Plasma TNFα and C-Reactive Protein in Patients with Hypertension Accompanied by Impaired Glucose Tolerance … Akande TO, Adeleye JO, Kadiri S, et al (2013). Insulin resistance in Nigerians with essential hypertension …","https://www.koreascience.or.kr/article/JAKO201528551641061.pdf","https://scholar.google.com/scholar?q=related:0lvioykDM2AJ:scholar.google.com/&scioq=%22impaired+glucose+tolerance%22+nigeria&hl=en&as_sdt=0,5&as_ylo=2015&as_yhi=2015&as_vis=1"
18,"EU Nwose, VM Oguoma, PT Bwititi, ...","Metabolic syndrome and prediabetes in ndokwa community of Nigeria: preliminary study",2015,"North American journal …","ncbi.nlm.nih.gov","https://www.ncbi.nlm.nih.gov/pmc/articles/PMC4358049/","https://scholar.google.com/scholar?cites=9531960248488006789&as_sdt=2005&sciodt=0,5&hl=en",4,"2021-07-31 04:58:08","HTML","","","",,,,,18,3.00,5,4,6,"… high prevalence of prediabetes using impaired fasting glucose (IFG) or impaired glucose tolerance (IGT) as … the Principal of Abbi Grammar School, Abbi; Ndokwa West local government of Nigeria. The Nigerian High Commissioner to Australia also supported this work during the …","https://www.ncbi.nlm.nih.gov/pmc/articles/PMC4358049/","https://scholar.google.com/scholar?q=related:hZRF8FdTSIQJ:scholar.google.com/&scioq=%22impaired+glucose+tolerance%22+nigeria&hl=en&as_sdt=0,5&as_ylo=2015&as_yhi=2015&as_vis=1"
14,"IO Oluwayemi, SJ Brink, EE Oyenusi, ...","Fasting blood glucose profile among secondary school adolescents in Ado-Ekiti, Nigeria",2015,"Journal of nutrition and …","hindawi.com","https://www.hindawi.com/journals/jnme/2015/417859/","https://scholar.google.com/scholar?cites=13784463813539566513&as_sdt=2005&sciodt=0,5&hl=en",5,"2021-07-31 04:58:08","HTML","","","",,,,,14,2.33,4,4,6,"… and coronary heart diseases globally [1–3]. Increased risk of impaired glucose tolerance, insulin resistance … Data on FBG among Nigerian adolescents are scarce, hence the need for the present … Ekiti, a relatively new and rapidly developing state capital in Nigeria with changes in …","https://www.hindawi.com/journals/jnme/2015/417859/","https://scholar.google.com/scholar?q=related:sZNAIc5ATL8J:scholar.google.com/&scioq=%22impaired+glucose+tolerance%22+nigeria&hl=en&as_sdt=0,5&as_ylo=2015&as_yhi=2015&as_vis=1"
1,"AH Salami, CO Agboghoroma, JAF Momoh","The prevalence and risk factors for gestational diabetes and pregnancy outcome in a tertiary hospital in Ahuja, Nigeria",2015,"Tropical Journal of Obstetrics …","ajol.info","https://www.ajol.info/index.php/tjog/article/view/125053","https://scholar.google.com/scholar?cites=1964451867601921925&as_sdt=2005&sciodt=0,5&hl=en",6,"2021-07-31 04:58:08","","","","",,,,,1,0.17,0,3,6,"… Abuja, Nigeria. This is a tertiary hospital and main … j) (1) . Augusl 2015 gestational hyperglycemia associated with maternal gestational diabetes mellitus in Nigerian women 15. 16. 17. 18. 19 … outcomes of pregnancies complicated with gestational impaired glucose tolerance and …","https://www.ajol.info/index.php/tjog/article/download/125053/114586","https://scholar.google.com/scholar?q=related:hefDwpAiQxsJ:scholar.google.com/&scioq=%22impaired+glucose+tolerance%22+nigeria&hl=en&as_sdt=0,5&as_ylo=2015&as_yhi=2015&as_vis=1"
0,"SJ Brink","Fasting Blood Glucose Profile among Secondary School Adolescents in Ado-Ekiti, Nigeria",2015,"","academia.edu","https://www.academia.edu/download/46944814/Fasting_Blood_Glucose_Profile_among_Seco20160701-8894-1rka3i1.pdf","",7,"2021-07-31 04:58:08","PDF","","","",,,,,0,0.00,0,1,6,"… and coronary heart diseases globally [1–3]. Increased risk of impaired glucose tolerance, insulin resistance … Data on FBG among Nigerian adolescents are scarce, hence the need for the present … Ekiti, a relatively new and rapidly developing state capital in Nigeria with changes in …","https://www.academia.edu/download/46944814/Fasting_Blood_Glucose_Profile_among_Seco20160701-8894-1rka3i1.pdf","https://scholar.google.com/scholar?q=related:dyNUtLikuwoJ:scholar.google.com/&scioq=%22impaired+glucose+tolerance%22+nigeria&hl=en&as_sdt=0,5&as_ylo=2015&as_yhi=2015&as_vis=1"
0,"CI Okafor, CE Okoli","CB Nwatu, EN Ofoegbu, CN Unachukwu, EE Young",,"researchgate.net","","https://www.researchgate.net/profile/Christian-Ifedili-Okafor/publication/279213499_Prevalence_of_prediabetes_and_associated_risk_factors_in_a_rural_Nigerian_community/links/55b6fa9508aed621de044495/Prevalence-of-prediabetes-and-associated-risk-factors-in-a-rural-Nigerian-community.pdf","",8,"2021-07-31 04:58:08","PDF","","","",,,,,0,0.00,0,2,,"… of prediabetes (IFG and IGT) at 21.5 % was found in this rural Nigerian community … Prevalence of diabetes mellitus and impaired glucose tolerance in a group of urban adults in Nigeria … High prevalence and low awareness of hypertension in a market population in Enugu, Nigeria …","https://www.researchgate.net/profile/Christian-Ifedili-Okafor/publication/279213499_Prevalence_of_prediabetes_and_associated_risk_factors_in_a_rural_Nigerian_community/links/55b6fa9508aed621de044495/Prevalence-of-prediabetes-and-associated-risk-factors-in-a-rural-Nigerian-community.pdf","https://scholar.google.com/scholar?q=related:xzrMm2qHdGMJ:scholar.google.com/&scioq=%22impaired+glucose+tolerance%22+nigeria&hl=en&as_sdt=0,5&as_ylo=2015&as_yhi=2015&as_vis=1"
7,"T Jaja, AO Oduwole, B Fetuga, ...","Prevalence of prediabetes in secondary school students in Port Harcourt, Nigeria",2015,"African …","africanjournalofdiabetesmedicine …","https://www.africanjournalofdiabetesmedicine.com/articles/7.%20AJDM-489%20(Jaja).pdf","https://scholar.google.com/scholar?cites=396282468162013779&as_sdt=2005&sciodt=0,5&hl=en",9,"2021-07-31 04:58:08","PDF","","","",,,,,7,1.17,2,4,6,"… higher insulin resistance recorded in early adolescence.13 We conclude that prediabetes is prevalent in second- ary school students in Port Harcourt, Nigeria … 4. Sicree R, Shaw J, Zimmet P. Diabetes Atlas, IDF.4. The global bur- den: diabetes and impaired glucose tolerance …","https://www.africanjournalofdiabetesmedicine.com/articles/7.%20AJDM-489%20(Jaja).pdf","https://scholar.google.com/scholar?q=related:UwqDIc7gfwUJ:scholar.google.com/&scioq=%22impaired+glucose+tolerance%22+nigeria&hl=en&as_sdt=0,5&as_ylo=2015&as_yhi=2015&as_vis=1"
1,"SS Onasanya, RO Tijani, TO Onasanya, ...","… artemeter-lumefantrine (Co-ArtemR) for the treatment of uncomplicated plasmodium falciparum T Malaria in Ijebu ode local government health services in Nigeria",2015,"Clinical …","clinicaltherapeutics.com","https://www.clinicaltherapeutics.com/article/S0149-2918(15)00342-2/abstract","https://scholar.google.com/scholar?cites=4287720737910054827&as_sdt=2005&sciodt=0,5&hl=en",10,"2021-07-31 04:58:08","","","","",,,,,1,0.17,0,4,6,"… and tolerability of two fixed- dose formulation of ACT, artemisinin-piperaquine (ArtequickR) and (Coartem), for the treat- ment of P. falciparum in Nigeria … The unregulated use of this over-the-counter drug might be a risk factor for impaired glucose tolerance and type 2 diabetes.","https://www.clinicaltherapeutics.com/article/S0149-2918(15)00342-2/pdf","https://scholar.google.com/scholar?q=related:q180N0sLgTsJ:scholar.google.com/&scioq=%22impaired+glucose+tolerance%22+nigeria&hl=en&as_sdt=0,5&as_ylo=2015&as_yhi=2015&as_vis=1"
13,"ML Agbre-Yace, EE Oyenusi, AO Oduwole, ...","Prevalence of diabetes mellitus among children and adolescents in the district of Abidjan in Cote d'Ivoire: a population-based study",2015,"Journal of Diabetes & …","Springer","https://link.springer.com/article/10.1186/s40200-016-0261-7","https://scholar.google.com/scholar?cites=13510789933185328075&as_sdt=2005&sciodt=0,5&hl=en",11,"2021-07-31 04:58:08","HTML","10.1186/s40200-016-0261-7","","",,,,,13,2.17,3,4,6,"… No impaired glucose tolerance was identified in this population of children after the OGTT … higher than a case prevalence of 0.33/1000 in a South-Eastern Nigerian population based … from South-East [13], South-South [14] and North-Western [15, 16] Nigeria, respectively were …","https://link.springer.com/article/10.1186/s40200-016-0261-7","https://scholar.google.com/scholar?q=related:y2Nvatz3f7sJ:scholar.google.com/&scioq=%22impaired+glucose+tolerance%22+nigeria&hl=en&as_sdt=0,5&as_ylo=2015&as_yhi=2015&as_vis=1"
42,"R Oluyombo, MA Olamoyegun, O Olaifa, ...","Cardiovascular risk factors in semi-urban communities in southwest Nigeria: Patterns and prevalence",2015,"Journal of epidemiology …","Elsevier","https://www.sciencedirect.com/science/article/pii/S2210600614000732","https://scholar.google.com/scholar?cites=10868602223120679793&as_sdt=2005&sciodt=0,5&hl=en",12,"2021-07-31 04:58:08","HTML","","","",,,,,42,7.00,11,4,6,"… Cardiovascular risk factors in semi-urban communities in southwest Nigeria: Patterns and prevalence … Methods. This is a cross-sectional study of cardiovascular risk factors among semi-urban dwellers in Ekiti State, south-western, Nigeria …","https://www.sciencedirect.com/science/article/pii/S2210600614000732","https://scholar.google.com/scholar?q=related:cQMhOiMI1ZYJ:scholar.google.com/&scioq=%22impaired+glucose+tolerance%22+nigeria&hl=en&as_sdt=0,5&as_ylo=2015&as_yhi=2015&as_vis=1"
43,"RN Oputa, S Chinenye","Diabetes in Nigeria–a translational medicine approach",2015,"African J Diab …","africanjournalofdiabetesmedicine …","https://www.africanjournalofdiabetesmedicine.com/articles/6.%20AJDM-496%20(Oputa).pdf","https://scholar.google.com/scholar?cites=12256822472000995934&as_sdt=2005&sciodt=0,5&hl=en",13,"2021-07-31 04:58:08","PDF","","","",,,,,43,7.17,22,2,6,"… 5. Advancing age 6. Hypertension 7. Family history 8. History of previous impaired glucose tolerance (IGT) or … Table 2. Glycaemic indices (GI) and calories of some Nigerian foods … and Diet: A Simple Guide for Diabetes Health Care Providers.x Lagos, Nigeria: Lagos University …","https://www.africanjournalofdiabetesmedicine.com/articles/6.%20AJDM-496%20(Oputa).pdf","https://scholar.google.com/scholar?q=related:XgKlThn7GKoJ:scholar.google.com/&scioq=%22impaired+glucose+tolerance%22+nigeria&hl=en&as_sdt=0,5&as_ylo=2015&as_yhi=2015&as_vis=1"
6,"WE Ugege, A Abasiattai, A Umoiyoho, ...","The prevalence of gestational diabetes among antenatal attendees in a tertiary hospital in south–south Nigeria",2015,"International Journal of …","researchgate.net","https://www.researchgate.net/profile/Aniekan-Abasiattai/publication/281932151_The_Prevalence_of_Gestational_Diabetes_among_antenatal_attendees_in_a_tertiary_hospital_in_south_south_Nigeria/links/55fe699c08aeafc8ac7abb02/The-Prevalence-of-Gestational-Diabetes-among-antenatal-attendees-in-a-tertiary-hospital-in-south-south-Nigeria.pdf","https://scholar.google.com/scholar?cites=2841521102107826202&as_sdt=2005&sciodt=0,5&hl=en",14,"2021-07-31 04:58:08","PDF","","","",,,,,6,1.00,2,4,6,"… attendees in a tertiary hospital in south –south Nigeria … Between 24-28 weeks of gestation, women at high risk of developing GDM or impaired glucose tolerance (IGT) should be screened by means of an oral glucose tolerance test, using a 75 grams glucose load …","https://www.researchgate.net/profile/Aniekan-Abasiattai/publication/281932151_The_Prevalence_of_Gestational_Diabetes_among_antenatal_attendees_in_a_tertiary_hospital_in_south_south_Nigeria/links/55fe699c08aeafc8ac7abb02/The-Prevalence-of-Gestational-Diabetes-among-antenatal-attendees-in-a-tertiary-hospital-in-south-south-Nigeria.pdf","https://scholar.google.com/scholar?q=related:GtjpKGMcbycJ:scholar.google.com/&scioq=%22impaired+glucose+tolerance%22+nigeria&hl=en&as_sdt=0,5&as_ylo=2015&as_yhi=2015&as_vis=1"
11,"CO John, JO Alegbeleye, ...","Foeto-maternal outcome of diabetes in a tertiary health facility in Nigeria",2015,"African …","africanjournalofdiabetesmedicine …","https://www.africanjournalofdiabetesmedicine.com/articles/AJDM-503%20(Osita).pdf","https://scholar.google.com/scholar?cites=16072906858762664047&as_sdt=2005&sciodt=0,5&hl=en",15,"2021-07-31 04:58:08","PDF","","","",,,,,11,1.83,4,3,6,"… Outcomes of pregnancies affected by impaired glucose tolerance … AS, Musa J. Prevalence and associated risk factors for gestational diabetes in Jos, north-central, Nigeria … Diagnosis of ges- tational diabetes mellitus in Nigerian women – comparison between 75g and 100g oral …","https://www.africanjournalofdiabetesmedicine.com/articles/AJDM-503%20(Osita).pdf","https://scholar.google.com/scholar?q=related:b_h8UKFvDt8J:scholar.google.com/&scioq=%22impaired+glucose+tolerance%22+nigeria&hl=en&as_sdt=0,5&as_ylo=2015&as_yhi=2015&as_vis=1"
0,"SJ Showande, JJ Bello","Remedies for glucose intolerance–are traditional herbal concoctions for diabetes effective?",2015,"Nigerian Journal of Pharmaceutical …","researchgate.net","https://www.researchgate.net/profile/Showande-Segun/publication/313063603_Remedies_for_glucose_intolerance_-_are_traditional_herbal_concoctions_for_diabetes_effective/links/588f4155aca272fa50e19911/Remedies-for-glucose-intolerance-are-traditional-herbal-concoctions-for-diabetes-effective.pdf","",16,"2021-07-31 04:58:08","PDF","","","",,,,,0,0.00,0,2,6,"… Nigerian Journal of Pharmaceutical Research 11, 1 (2015):110-118 … Prevention of Type II diabetes in subjects with impaired glucose tolerance: the Diabetes Prevention Study (DPS) in … The use of plants in the traditional management of diabetes in Nigeria: Pharmacological and …","https://www.researchgate.net/profile/Showande-Segun/publication/313063603_Remedies_for_glucose_intolerance_-_are_traditional_herbal_concoctions_for_diabetes_effective/links/588f4155aca272fa50e19911/Remedies-for-glucose-intolerance-are-traditional-herbal-concoctions-for-diabetes-effective.pdf","https://scholar.google.com/scholar?q=related:pte3eierYVsJ:scholar.google.com/&scioq=%22impaired+glucose+tolerance%22+nigeria&hl=en&as_sdt=0,5&as_ylo=2015&as_yhi=2015&as_vis=1"
4,"AN Odili, EO Abatta","Blood pressure indices, life-style factors and anthropometric correlates of casual blood glucose in a rural Nigerian community",2015,"Annals of African medicine","annalsafrmed.org","https://www.annalsafrmed.org/article.asp?issn=1596-3519;year=2015;volume=14;issue=1;spage=39;epage=45;aulast=Odili","https://scholar.google.com/scholar?cites=5371955360684512035&as_sdt=2005&sciodt=0,5&hl=en",17,"2021-07-31 04:58:08","HTML","","","",,,,,4,0.67,2,2,6,"… factors and anthropometric correlates of casual blood glucose in a rural Nigerian community … Nigeria and indeed many countries of sub-Saharan Africa faces an emerging epidemic … People with diabetes mellitus and impaired glucose tolerance identified by 2 h post-glucose load …","https://www.annalsafrmed.org/article.asp?issn=1596-3519;year=2015;volume=14;issue=1;spage=39;epage=45;aulast=Odili","https://scholar.google.com/scholar?q=related:IxPbTvAEjUoJ:scholar.google.com/&scioq=%22impaired+glucose+tolerance%22+nigeria&hl=en&as_sdt=0,5&as_ylo=2015&as_yhi=2015&as_vis=1"
21,"N Meme, S Amwayi, Z Nganga, E Buregyeya","Prevalence of undiagnosed diabetes and pre-diabetes among hypertensive patients attending Kiambu district Hospital, Kenya: a cross-sectional study",2015,"Pan African Medical Journal","ajol.info","https://www.ajol.info/index.php/pamj/article/view/142120","https://scholar.google.com/scholar?cites=7183158586356232855&as_sdt=2005&sciodt=0,5&hl=en",18,"2021-07-31 04:58:08","","","","",,,,,21,3.50,5,4,6,"… In Germany, Luders et al found out of 260 hypertensive patients 39% had impaired glucose tolerance and 12% had … Risk factors of pre-diabetes among adult nigerians with essential hypertension in a resource-constrained setting of a primary care clinic in eastern Nigeria …","https://www.ajol.info/index.php/pamj/article/view/142120/131859","https://scholar.google.com/scholar?q=related:l3IPIa20r2MJ:scholar.google.com/&scioq=%22impaired+glucose+tolerance%22+nigeria&hl=en&as_sdt=0,5&as_ylo=2015&as_yhi=2015&as_vis=1"
0,"TB Stage, P Damkier, MMH Christensen, ...","St. John's wort impairs Glucose tolerance by reducing insulin response in healthy Men",2015,"Clinical …","clinicaltherapeutics.com","https://www.clinicaltherapeutics.com/article/S0149-2918(15)00344-6/abstract","",19,"2021-07-31 04:58:08","","","","",,,,,0,0.00,0,4,6,"… and tolerability of two fixed- dose formulation of ACT, artemisinin-piperaquine (ArtequickR) and (Coartem), for the treat- ment of P. falciparum in Nigeria … The unregulated use of this over-the-counter drug might be a risk factor for impaired glucose tolerance and type 2 diabetes …","https://www.clinicaltherapeutics.com/article/S0149-2918(15)00344-6/pdf",""
84,"O Awodele, JA Osuolale","Medication adherence in type 2 diabetes patients: study of patients in Alimosho General Hospital, Igando, Lagos, Nigeria.",2015,"African health sciences","ajol.info","https://www.ajol.info/index.php/ahs/article/view/117570","https://scholar.google.com/scholar?cites=7793194985861634974&as_sdt=2005&sciodt=0,5&hl=en",20,"2021-07-31 04:58:08","","","","",,,,,84,14.00,42,2,6,"… Methodology Study area The study was carried out in Alimosho general hospi- tal, Igando, Lagos, Nigeria, a 101 bed secondary public health care facility with average hospital attendance at the medical clinic of 240 diabetic patients per … Impaired glucose tolerance ≥7.8 (≥140 …","https://www.ajol.info/index.php/ahs/article/view/117570/107137","https://scholar.google.com/scholar?q=related:nlujrYz9JmwJ:scholar.google.com/&scioq=%22impaired+glucose+tolerance%22+nigeria&hl=en&as_sdt=0,5&as_ylo=2015&as_yhi=2015&as_vis=1"
16,"AO Oko, AC Famurewa, ...","Proximate composition, mineral elements and starch characteristics: study of eight (8) unripe plantain cultivars in Nigeria",2015,"British Journal of …","pdfs.semanticscholar.org","https://pdfs.semanticscholar.org/1eb2/cccdab8d8248366e672dae80ef650ad37f41.pdf","https://scholar.google.com/scholar?cites=9568486645372593696&as_sdt=2005&sciodt=0,5&hl=en",21,"2021-07-31 04:58:08","PDF","","","",,,,,16,2.67,5,3,6,"… Dietary modification for the diabetes patients, individuals with impaired glucose tolerance or people with particular concern for their diets and health may consider unripe plantain intake in meals. COMPETING INTERESTS … A reference manual, IITA, Ibadan, Nigeria. 1990;1-18 …","https://pdfs.semanticscholar.org/1eb2/cccdab8d8248366e672dae80ef650ad37f41.pdf","https://scholar.google.com/scholar?q=related:IKaAb-gXyoQJ:scholar.google.com/&scioq=%22impaired+glucose+tolerance%22+nigeria&hl=en&as_sdt=0,5&as_ylo=2015&as_yhi=2015&as_vis=1"
5,"IO Oluwayemi, MA Oluwayemi","Relationship between Obesity and Fasting Blood Glucose among Secondary School Adolescents in Ado-Ekiti, South West Nigeria",2015,"International Journal of …","researchgate.net","https://www.researchgate.net/profile/Oludare-Oluwayemi-2/publication/278243688_Relationship_between_Obesity_and_Fasting_Blood_Glucose_among_Secondary_School_Adolescents_in_Ado-Ekiti_South_West_Nigeria/links/557dcfb608aeb61eae247af9/Relationship-between-Obesity-and-Fasting-Blood-Glucose-among-Secondary-School-Adolescents-in-Ado-Ekiti-South-West-Nigeria.pdf","https://scholar.google.com/scholar?cites=12477369754070030087&as_sdt=2005&sciodt=0,5&hl=en",22,"2021-07-31 04:58:08","PDF","","","",,,,,5,0.83,3,2,6,"… has been found to be associated with increased risk of impaired glucose tolerance, insulin resistance … Profile of body mass index and obesity in Nigerian children and adolescents … Obesity and elevated blood pressure among adolescents in Lagos, Nigeria: a cross-sectional study …","https://www.researchgate.net/profile/Oludare-Oluwayemi-2/publication/278243688_Relationship_between_Obesity_and_Fasting_Blood_Glucose_among_Secondary_School_Adolescents_in_Ado-Ekiti_South_West_Nigeria/links/557dcfb608aeb61eae247af9/Relationship-between-Obesity-and-Fasting-Blood-Glucose-among-Secondary-School-Adolescents-in-Ado-Ekiti-South-West-Nigeria.pdf","https://scholar.google.com/scholar?q=related:BxeM8q6FKK0J:scholar.google.com/&scioq=%22impaired+glucose+tolerance%22+nigeria&hl=en&as_sdt=0,5&as_ylo=2015&as_yhi=2015&as_vis=1"
6,"CF Chukwunyere, DO Awonuga, ...","Gestational Diabetes in a tertiary healthcare centre at Abeokuta, south western Nigeria: A five year retrospective review",2015,"International Journal of …","journalbank.org","https://journalbank.org/index.php/IJTDH/article/view/2186","https://scholar.google.com/scholar?cites=3692080515891847239&as_sdt=2005&sciodt=0,5&hl=en",23,"2021-07-31 04:58:08","","","","",,,,,6,1.00,2,3,6,"… Idi- Araba, Lagos, Nigeria … of variable severity with onset or first recognition during pregnancy"" [12,13], was first proposed by the National Diabetes Data Group (NDDG) in 1979 [8,19], although that group used the term ""diabetes or impaired glucose tolerance (IGT)"" [12] rather …","https://journalbank.org/index.php/IJTDH/article/download/2186/4369","https://scholar.google.com/scholar?q=related:R-Df76rnPDMJ:scholar.google.com/&scioq=%22impaired+glucose+tolerance%22+nigeria&hl=en&as_sdt=0,5&as_ylo=2015&as_yhi=2015&as_vis=1"
24,"L Muthunarayanan, B Ramraj, ...","Prevalence of prediabetes and its associated risk factors among rural adults in Tamil Nadu",2015,"Archives of medicine and …","amhsjournal.org","https://www.amhsjournal.org/article.asp?issn=2321-4848;year=2015;volume=3;issue=2;spage=178;epage=184;aulast=Muthunarayanan","https://scholar.google.com/scholar?cites=44630034439628435&as_sdt=2005&sciodt=0,5&hl=en",24,"2021-07-31 04:58:08","HTML","","","",,,,,24,4.00,8,3,6,"… 28. 29. Qian Q, Joushilahti P, Erikson J, Tuomilehto J. Predictive propertiesof impaired glucose tolerance for cardiovascular risks are not explained by the … for prediabetes screening among non-diabetic adults attending the family practice clinic in Western Nigeria: Implication for …","https://www.amhsjournal.org/article.asp?issn=2321-4848;year=2015;volume=3;issue=2;spage=178;epage=184;aulast=Muthunarayanan","https://scholar.google.com/scholar?q=related:k2YWpceOngAJ:scholar.google.com/&scioq=%22impaired+glucose+tolerance%22+nigeria&hl=en&as_sdt=0,5&as_ylo=2015&as_yhi=2015&as_vis=1"
1,"AN Onyiriuka, CA Ofoeze","Prediabetes in three siblings of a Nigerian boy with type 1 diabetes mellitus: Is this a case of familial clustering?",2015,"Aristotle University Medical Journal","ejournals.lib.auth.gr","http://ejournals.lib.auth.gr/aumj/article/view/4572","https://scholar.google.com/scholar?cites=14525191940755568030&as_sdt=2005&sciodt=0,5&hl=en",25,"2021-07-31 04:58:08","","","","",,,,,1,0.17,1,2,6,"… Department of Child Health,University of Benin Teaching Hospital, PMB 1111, Benin City, Nigeria … Prediabetes in three siblings of a Nigerian boy with type 1 diabetes mellitus … Impaired fasting glucose or impaired glucose tolerance: what best predicts future diabetes in Mauritus …","http://ejournals.lib.auth.gr/aumj/article/download/4572/4671","https://scholar.google.com/scholar?q=related:njUawxzZk8kJ:scholar.google.com/&scioq=%22impaired+glucose+tolerance%22+nigeria&hl=en&as_sdt=0,5&as_ylo=2015&as_yhi=2015&as_vis=1"
