Cites,Authors,Title,Year,Source,Publisher,ArticleURL,CitesURL,GSRank,QueryDate,Type,DOI,ISSN,CitationURL,Volume,Issue,StartPage,EndPage,ECC,CitesPerYear,CitesPerAuthor,AuthorCount,Age,Abstract,FullTextURL,RelatedURL
0,"P Kumar, S Deb, A de Wagt, P Gupta, N Bhandari…","Managing at risk mothers and infants under six months in India–no time to waste",2020,"Field Exchange …","ennonline.net","https://www.ennonline.net/fex/63/mamiindia","",516,"2021-07-31 07:13:36","HTML","","","",,,,,0,0.00,0,6,1,"… Arjan de Wagt is Chief of Nutrition Section, UNICEF India country office, New Delhi. He has over 25 years' experience in several countries, including Nigeria, Zambia, New York and the Netherlands … Fetal and infant growth and impaired glucose tolerance at age 64. BMJ …","https://www.ennonline.net/fex/63/mamiindia","https://scholar.google.com/scholar?q=related:GkjTLglEuaEJ:scholar.google.com/&scioq=%22impaired+glucose+tolerance%22+nigeria&hl=en&as_sdt=0,5&as_ylo=2020&as_yhi=2021&as_vis=1"
0,"N Joharatnam‐Hogan, P Chambers…","A guideline for the outpatient management of glycaemic control in people with cancer",2021,"Diabetic …","Wiley Online Library","https://onlinelibrary.wiley.com/doi/abs/10.1111/dme.14636","",517,"2021-07-31 07:13:36","","10.1111/dme.14636","","",,,,,0,0.00,0,3,1,"Page 1. This article has been accepted for publication and undergone full peer review but has not been through the copyediting, typesetting, pagination and proofreading process, which may lead to differences between this version and the Version of Record …","",""
0,"NT Ha, DT Sinh, LTT Ha","The Association of Family Support and Health Education with the Status of Overweight and Obesity in Patients with Type 2 Diabetes Receiving Outpatient Treatment …",2021,"Health Services Insights","journals.sagepub.com","https://journals.sagepub.com/doi/abs/10.1177/11786329211014793","",518,"2021-07-31 07:13:36","","10.1177/11786329211014793","","",,,,,0,0.00,0,3,1,"This study aims to establish the association of family support and nutrition and health education by health workers with the status of overweight and obesity among patients with type 2 diabetes mel...","https://journals.sagepub.com/doi/pdf/10.1177/11786329211014793","https://scholar.google.com/scholar?q=related:lhCx10Ix2rIJ:scholar.google.com/&scioq=%22impaired+glucose+tolerance%22+nigeria&hl=en&as_sdt=0,5&as_ylo=2020&as_yhi=2021&as_vis=1"
0,"S Jacob","Awareness about foot care and factors affecting its practice among urban slum dwellers with Type 2 Diabetes Mellitus of Vellore",2020,"","repository-tnmgrmu.ac.in","http://repository-tnmgrmu.ac.in/id/eprint/13925","",519,"2021-07-31 07:13:36","","","","",,,,,0,0.00,0,1,1,"… 2. Prediabetes: Prediabetes is a practical convenient term referring to impaired fasting glucose, impaired glucose tolerance test or glycated haemoglobin (A1C) of 6.0% to 6.4 … resistance and impaired glucose tolerance than lower body or female-type obesity (7) …","http://repository-tnmgrmu.ac.in/13925/1/202501120susan_jacob.pdf","https://scholar.google.com/scholar?q=related:iciFnHYpmPYJ:scholar.google.com/&scioq=%22impaired+glucose+tolerance%22+nigeria&hl=en&as_sdt=0,5&as_ylo=2020&as_yhi=2021&as_vis=1"
0,"E Lee, MH Jang","The Influence of Body Image, Insight, and Mental Health Confidence on Medication Adherence in Young Adult Women with Mental Disorders",2021,"International Journal of Environmental Research and …","mdpi.com","https://www.mdpi.com/1660-4601/18/8/3866","",520,"2021-07-31 07:13:36","","","","",,,,,0,0.00,0,2,1,"… which have recently become popular, show better results than typical antipsychotic medications regarding treatment effect, side effects, and medication adherence, but cause major metabolic disorders, including high blood pressure, impaired glucose tolerance, and abnormal …","https://www.mdpi.com/1660-4601/18/8/3866/pdf","https://scholar.google.com/scholar?q=related:GsbKmD6J0oYJ:scholar.google.com/&scioq=%22impaired+glucose+tolerance%22+nigeria&hl=en&as_sdt=0,5&as_ylo=2020&as_yhi=2021&as_vis=1"
0,"D Adu, AO Ojo","Ethnicity and Chronic Kidney Disease in Africa",2020,"Chronic Renal Disease","Elsevier","https://www.sciencedirect.com/science/article/pii/B9780128158760000115","",521,"2021-07-31 07:13:36","","","","",,,,,0,0.00,0,2,1,"… The highest frequencies of the G1 and G2 variants have been observed among the Yoruba and Igbo tribes in Southern Nigeria, with East Africans generally having the lowest frequencies … West Africa. Mandenka, Senegal, 5, 21. Yoruba, Nigeria, 45, 17. Igbo, Nigeria, 30, 25 …","",""
0,"FA Olabiyi","Hepato-renal, cardiac and reproductive effects of phyllanthus amarus leaf extract in streptozotocin-induced diabetic male wistar rats",2020,"","ir.cput.ac.za","http://ir.cput.ac.za/handle/20.500.11838/3207","",522,"2021-07-31 07:13:36","","","","",,,,,0,0.00,0,1,1,"Page 1. HEPATO-RENAL, CARDIAC AND REPRODUCTIVE EFFECTS OF PHYLLANTHUS AMARUS LEAF EXTRACT IN STREPTOZOTOCIN-INDUCED DIABETIC MALE WISTAR RATS by FOLORUNSO ADEWALE OLABIYI …","http://ir.cput.ac.za/bitstream/20.500.11838/3207/1/Olabiyi__Folorunso__213065401.pdf",""
0,"N Alqabandi, E Al-Ozairi, A Ahmed, EL Ross…","Secondary Impact of Social Media via Text Message Screening for Type 2 Diabetes Risk in Kuwait: Survey Study",2020,"JMIR …","diabetes.jmir.org","https://diabetes.jmir.org/2020/4/e20532","",523,"2021-07-31 07:13:36","HTML","","","",,,,,0,0.00,0,5,1,"… This phase is associated with either one or both kinds of glucose levels: fasting glucose and impaired glucose tolerance [3]. Environmental and genetic factors as well as a sedentary lifestyle and unhealthy eating habits are known to play key roles …","https://diabetes.jmir.org/2020/4/e20532","https://scholar.google.com/scholar?q=related:OwL_cAJDJ-QJ:scholar.google.com/&scioq=%22impaired+glucose+tolerance%22+nigeria&hl=en&as_sdt=0,5&as_ylo=2020&as_yhi=2021&as_vis=1"
2,"R Saif-Ali, NA Kamaruddin, ALH Molham…","Relationship of metabolic syndrome defined by IDF or revised NCEP ATP III with glycemic control among Malaysians with Type 2 Diabetes",2020,"Diabetology & metabolic …","Springer","https://link.springer.com/article/10.1186/s13098-020-00575-7","https://scholar.google.com/scholar?cites=6784302789470878645&as_sdt=2005&sciodt=0,5&hl=en",524,"2021-07-31 07:13:36","HTML","10.1186/s13098-020-00575-7","","",,,,,2,2.00,1,4,1,"… Obesity and physical inactivity are the driving force for MetS, and a person with MetS has a fivefold relative risk to develop T2D [6, 13,14,15]. Overweight and obesity lead to adverse metabolic effects on BP, HDL-C, TG, and impaired glucose tolerance (IGT) [16] …","https://link.springer.com/article/10.1186/s13098-020-00575-7","https://scholar.google.com/scholar?q=related:tXsaN3GvJl4J:scholar.google.com/&scioq=%22impaired+glucose+tolerance%22+nigeria&hl=en&as_sdt=0,5&as_ylo=2020&as_yhi=2021&as_vis=1"
0,"SMNA Hafez, NM Zenhom, HA Abdel-Hamid","Effects of platelet rich plasma on experimentally induced diabetic heart injury",2021,"International …","Elsevier","https://www.sciencedirect.com/science/article/pii/S1567576921004501","",525,"2021-07-31 07:13:36","","","","",,,,,0,0.00,0,3,1,"JavaScript is disabled on your browser. Please enable JavaScript to use all the features on this page. Skip to main content Skip to article …","","https://scholar.google.com/scholar?q=related:CxrbUVYXYTkJ:scholar.google.com/&scioq=%22impaired+glucose+tolerance%22+nigeria&hl=en&as_sdt=0,5&as_ylo=2020&as_yhi=2021&as_vis=1"
0,"JA George, SA Norris, T Snyman, L Khambule…","Longitudinal changes in vitamin D and its metabolites in pregnant South Africans",2021,"The Journal of Steroid …","Elsevier","https://www.sciencedirect.com/science/article/pii/S0960076021001424","",526,"2021-07-31 07:13:36","","","","",,,,,0,0.00,0,5,1,"JavaScript is disabled on your browser. Please enable JavaScript to use all the features on this page. Skip to main content Skip to article …","",""
0,"R Saif-Ali, NA Kamaruddin, AL Molham, SA Al-Dubai…","Relationship of Metabolic Syndrome Defined by IDF or Revised NCEP with Glycemic Control among Malaysians with Type 2 Diabetes",2020,"","assets.researchsquare.com","https://assets.researchsquare.com/files/rs-27358/v2/RevisedmanuscriptDIMSD2000152.doc","",527,"2021-07-31 07:13:36","DOC","","","",,,,,0,0.00,0,5,1,"… Overweight and obesity lead to adverse metabolic effects on blood pressure, HDL cholesterol, TG and impaired glucose tolerance (IGT) [16] … in patients with type 2 diabetes mellitus and their first degree relatives with metabolic syndrome seen in Benin City, Edo state Nigeria …","https://assets.researchsquare.com/files/rs-27358/v2/RevisedmanuscriptDIMSD2000152.doc","https://scholar.google.com/scholar?q=related:vt1FRqt0LOgJ:scholar.google.com/&scioq=%22impaired+glucose+tolerance%22+nigeria&hl=en&as_sdt=0,5&as_ylo=2020&as_yhi=2021&as_vis=1"
0,"J Owusu-Ansah","Factors influencing treatment outcomes of Patients with Diabetes and Hypertension at the Ejisu Government Hospital in Ejisu, Ashanti Region, Ghana",2020,"","ir.knust.edu.gh","http://ir.knust.edu.gh/handle/123456789/13221","",528,"2021-07-31 07:13:36","","","","",,,,,0,0.00,0,1,1,"… IGT Impaired Glucose Tolerance NCD Non-Communicable Diseases … A different clinical criteria exists for the clinical values associated with the diagnosis of Impaired Fasting Glucose (IFG) and Impaired Glucose Tolerance (IGT), as previously presented (Kahn, 2003) …","http://ir.knust.edu.gh/bitstream/123456789/13221/1/joepharm%27s%20final%20thesis.pdf","https://scholar.google.com/scholar?q=related:dvq7DauTdh4J:scholar.google.com/&scioq=%22impaired+glucose+tolerance%22+nigeria&hl=en&as_sdt=0,5&as_ylo=2020&as_yhi=2021&as_vis=1"
0,"R Tabassum, NY Jeong, J Jung","硫化氢对氧化应激诱导神经退行性疾病的保护",2020,"中国神经再生研究 (英文版)","sjzsyj.com.cn","https://www.sjzsyj.com.cn/CN/abstract/abstract3280.shtml","",529,"2021-07-31 07:13:36","","","","",,,,,0,0.00,0,3,1,"… 2015). It also causes impaired glucose tolerance in T2DM. Mostly … 2016). Increased oxidative stress might be the cause of insulin resistance, β-cell dys- function and impaired glucose tolerance in T2DM (Evans et al., 2003). At …","https://www.sjzsyj.com.cn/CN/article/downloadArticleFile.do?attachType=PDF&id=3280","https://scholar.google.com/scholar?q=related:IlbwwIQhoTgJ:scholar.google.com/&scioq=%22impaired+glucose+tolerance%22+nigeria&hl=en&as_sdt=0,5&as_ylo=2020&as_yhi=2021&as_vis=1"
0,"F Allyan, AH El Bilbeisi, M Adris, B Zabut…","The Association between Serum Galectin-3 and Biochemical Parameters with Cardiovascular Diseases among Type 2 Diabetes Patients in Gaza Strip …",2020,"Austin J Nutri Food …","researchgate.net","https://www.researchgate.net/profile/Abdel-El-Bilbeisi/publication/343588129_The_Association_between_Serum_Galectin-3_and_Biochemical_Parameters_with_Cardiovascular_Diseases_among_Type_2_Diabetes_Patients_in_Gaza_Strip_Palestine_A_Case-Control_Study/links/5f3e3d1c92851cd3020823fe/The-Association-between-Serum-Galectin-3-and-Biochemical-Parameters-with-Cardiovascular-Diseases-among-Type-2-Diabetes-Patients-in-Gaza-Strip-Palestine-A-Case-Control-Study.pdf","",530,"2021-07-31 07:13:36","PDF","","","",,,,,0,0.00,0,5,1,"Page 1. Citation: Allyan F, El Bilbeisi AH, Adris M, Zabut B, El Afifi A and Abu Mustafa A. The Association between Serum Galectin-3 and Biochemical Parameters with Cardiovascular Diseases among Type 2 Diabetes Patients in Gaza Strip, Palestine: A Case-Control Study …","https://www.researchgate.net/profile/Abdel-El-Bilbeisi/publication/343588129_The_Association_between_Serum_Galectin-3_and_Biochemical_Parameters_with_Cardiovascular_Diseases_among_Type_2_Diabetes_Patients_in_Gaza_Strip_Palestine_A_Case-Control_Study/links/5f3e3d1c92851cd3020823fe/The-Association-between-Serum-Galectin-3-and-Biochemical-Parameters-with-Cardiovascular-Diseases-among-Type-2-Diabetes-Patients-in-Gaza-Strip-Palestine-A-Case-Control-Study.pdf","https://scholar.google.com/scholar?q=related:Tk1_Kb95tmUJ:scholar.google.com/&scioq=%22impaired+glucose+tolerance%22+nigeria&hl=en&as_sdt=0,5&as_ylo=2020&as_yhi=2021&as_vis=1"
0,"MS Ellulu, IA Naser, SM Abuhajar…","Determination of risk factors associated with inflammation in hypertensive patients with type-2 diabetes mellitus in a Palestinian Diabetes Study",2021,"… Medical Research and …","Taylor & Francis","https://www.tandfonline.com/doi/abs/10.1080/03007995.2021.1941826","",531,"2021-07-31 07:13:36","","10.1080/03007995.2021.1941826","","",,,,,0,0.00,0,4,1,"… Furthermore, obesity, and especially visceral adipose tissue accumulation, increases the risk of impaired glucose tolerance [19] and the development of T2DM [20 … Blood pressure, prevalence of hypertension and hypertension related complications in Nigerian Africans: A review …","https://www.researchgate.net/profile/Mohammed-S-Ellulu/publication/352389847_Determination_of_risk_factors_associated_with_inflammation_in_hypertensive_patients_with_type-2_diabetes_mellitus_in_a_Palestinian_Diabetes_Study/links/60d58cb4a6fdcca0ddbce53e/Determination-of-risk-factors-associated-with-inflammation-in-hypertensive-patients-with-type-2-diabetes-mellitus-in-a-Palestinian-Diabetes-Study.pdf","https://scholar.google.com/scholar?q=related:tfKAu0TlCQcJ:scholar.google.com/&scioq=%22impaired+glucose+tolerance%22+nigeria&hl=en&as_sdt=0,5&as_ylo=2020&as_yhi=2021&as_vis=1"
0,"I Scientific, Organizing Committee","International Symposium on Reproductive Health: overcoming barriers for research in reproduction",2021,"Clinical and Experimental …","ceog.imrpress.com","https://ceog.imrpress.com/EN/abstract/abstract5494.shtml","",532,"2021-07-31 07:13:36","","","","",,,,,0,0.00,0,2,1,"Page 1. Conference Report International Symposium on Reproductive Health: overcoming barriers for research in reproduction ISRH2021 Scientific and Organizing Committee*,§ §ISRH2021 Scientific and Organizing Committee …","https://ceog.imrpress.com/EN/article/downloadArticleFile.do?attachType=PDF&id=5494",""
0,"J Qi, H Hu, L Yaghjyan, L An, HA Kalim…","Association of Adipose Tissue Distribution With Type 2 Diabetes in Breast Cancer Patients",2020,"Breast cancer: basic …","journals.sagepub.com","https://journals.sagepub.com/doi/abs/10.1177/1178223420972369","",533,"2021-07-31 07:13:36","","10.1177/1178223420972369","","",,,,,0,0.00,0,6,1,"Purpose:We examined the association of adipose tissue distribution with type 2 diabetes (T2D) in breast cancer patients.Methods:Participants (N = 238) diagnosed with breast cancer at 20-75 years ol...","https://journals.sagepub.com/doi/full/10.1177/1178223420972369","https://scholar.google.com/scholar?q=related:1hOhYi9U9dsJ:scholar.google.com/&scioq=%22impaired+glucose+tolerance%22+nigeria&hl=en&as_sdt=0,5&as_ylo=2020&as_yhi=2021&as_vis=1"
0,"UKC Board","The Management of Glycaemic Control in Patients with Cancer",2021,"","diabetestimes.co.uk","https://diabetestimes.co.uk/wp-content/uploads/2021/05/JBDS-17-Oncology-Guideline-final-21.05.21.pdf","",534,"2021-07-31 07:13:36","PDF","","","",,,,,0,0.00,0,1,1,"… A small clinical study of 88 patients with oestrogen receptor positive breast cancer found that hyperglycaemia induced chemo-resistance, with impaired glucose tolerance significantly correlated with disease progression in those patients receiving chemotherapy (15) …","https://diabetestimes.co.uk/wp-content/uploads/2021/05/JBDS-17-Oncology-Guideline-final-21.05.21.pdf","https://scholar.google.com/scholar?q=related:-TBOXBVnM7QJ:scholar.google.com/&scioq=%22impaired+glucose+tolerance%22+nigeria&hl=en&as_sdt=0,5&as_ylo=2020&as_yhi=2021&as_vis=1"
0,"DF Cuadros, J Li, G Musuka, SF Awad","WJD",2021,"","researchgate.net","https://www.researchgate.net/profile/Diego-Cuadros/publication/353195477_Spatial_epidemiology_of_diabetes_Methods_and_insights/links/60ec847816f9f313007c0a4c/Spatial-epidemiology-of-diabetes-Methods-and-insights.pdf","",535,"2021-07-31 07:13:36","PDF","","","",,,,,0,0.00,0,4,1,"… Moran's I and spatial regression [32] Individual and state level in Nigeria Geographic clustering of diabetes mellitus (DM) and a DM pocket existed in the southeastern part of Nigeria. Obesity and education attainment were associated …","https://www.researchgate.net/profile/Diego-Cuadros/publication/353195477_Spatial_epidemiology_of_diabetes_Methods_and_insights/links/60ec847816f9f313007c0a4c/Spatial-epidemiology-of-diabetes-Methods-and-insights.pdf",""
0,"R Saif-Ali, NA Kamaruddin, ALH Molham, SA Al-Dubai…","The Impact of Metabolic Syndrome Defined by IDF or Revised NCEP on Glycemic control in Malaysians with Type 2 Diabetes",2020,"","scholar.archive.org","https://scholar.archive.org/work/bp7zaesjb5bsxicskq3i2jvy34/access/wayback/https://assets.researchsquare.com/files/rs-27358/v1.pdf","",536,"2021-07-31 07:13:36","PDF","","","",,,,,0,0.00,0,5,1,"… Overweight and obesity lead to adverse metabolic effects on blood pressure, cholesterol, triglycerides (TG) and impaired glucose tolerance (IGT) (Rassool, 2003) … 2 diabetes mellitus and their first degree relatives with metabolic syndrome seen in Benin City, Edo state Nigeria …","https://scholar.archive.org/work/bp7zaesjb5bsxicskq3i2jvy34/access/wayback/https://assets.researchsquare.com/files/rs-27358/v1.pdf",""
0,"F Tekola-Ayele, M Ouidir, D Shrestha, T Workalemahu…","Admixture mapping identifies African and Amerindigenous local ancestry loci associated with fetal growth",2021,"Human Genetics","Springer","https://link.springer.com/article/10.1007/s00439-021-02265-4","",537,"2021-07-31 07:13:36","","10.1007/s00439-021-02265-4","","",,,,,0,0.00,0,5,1,"Fetal growth is an important determinant of cardiometabolic disease risk during childhood and adulthood. The genetic architecture of fetal growth remains l.","","https://scholar.google.com/scholar?q=related:erxoxxjTHgEJ:scholar.google.com/&scioq=%22impaired+glucose+tolerance%22+nigeria&hl=en&as_sdt=0,5&as_ylo=2020&as_yhi=2021&as_vis=1"
0,"AT Odularu, PA Ajibade","Challenge of diabetes mellitus and researchers' contributions to its control",2021,"Open Chemistry","degruyter.com","https://www.degruyter.com/document/doi/10.1515/chem-2020-0153/html","",538,"2021-07-31 07:13:36","HTML","10.1515/chem-2020-0153","","",,,,,0,0.00,0,2,1,"… about 1.2 million Nigerians, 841,000 South Africans, 552,000 Congolese, 550,000 Ethiopians, and 380,000 Tanzanians [25]. In terms of medical attention, the top five countries with the highest costs of diabetes' treatment are South Africa, Kenya, Zimbabwe, Nigeria, and Ghana …","https://www.degruyter.com/document/doi/10.1515/chem-2020-0153/html","https://scholar.google.com/scholar?q=related:1fvJrFMKXOcJ:scholar.google.com/&scioq=%22impaired+glucose+tolerance%22+nigeria&hl=en&as_sdt=0,5&as_ylo=2020&as_yhi=2021&as_vis=1"
6,"C Eleazu, JB Suleiman, ZA Othman…","Bee bread attenuates high fat diet induced renal pathology in obese rats via modulation of oxidative stress, downregulation of NF-kB mediated inflammation and Bax …",2020,"… of physiology and …","Taylor & Francis","https://www.tandfonline.com/doi/abs/10.1080/13813455.2020.1752258","https://scholar.google.com/scholar?cites=2302375250002001357&as_sdt=2005&sciodt=0,5&hl=en",539,"2021-07-31 07:13:36","","10.1080/13813455.2020.1752258","","",,,,,6,6.00,2,4,1,"Context: Global prevalence of obesity is increasing. Objective: To study the effect of bee bread (BB) on serum renal function parameters, oxidative stress, inflammatory and B-cell associated protei...","","https://scholar.google.com/scholar?q=related:zT0FZBeu8x8J:scholar.google.com/&scioq=%22impaired+glucose+tolerance%22+nigeria&hl=en&as_sdt=0,5&as_ylo=2020&as_yhi=2021&as_vis=1"
0,"JS Asati","Factors Affecting Medical Nutritional Therapy among Type 2 Diabetes Patients at Kenyatta National Hospital, Nairobi, Kenya",2021,"","ir.jkuat.ac.ke","http://ir.jkuat.ac.ke/handle/123456789/5517","",540,"2021-07-31 07:13:36","","","","",,,,,0,0.00,0,1,1,"… of people with diabetes, including Ethiopia (2.6 million), South Africa (1.8 million), Democratic Republic of Congo (1.7 million), and Nigeria (1.7 million) (IDF, 2017) … Insulin resistance increases a person's risk for developing impaired glucose tolerance and type 2 diabetes …","","https://scholar.google.com/scholar?q=related:5Ucb-ERd_70J:scholar.google.com/&scioq=%22impaired+glucose+tolerance%22+nigeria&hl=en&as_sdt=0,5&as_ylo=2020&as_yhi=2021&as_vis=1"
1,"I Lin, MY Lee, CW Wang, DW Wu, SC Chen","Gender Differences in the Relationships among Metabolic Syndrome and Various Obesity-Related Indices with Nonalcoholic Fatty Liver Disease in a Taiwanese …",2021,"International Journal of …","mdpi.com","https://www.mdpi.com/967336","https://scholar.google.com/scholar?cites=2891995311927106793&as_sdt=2005&sciodt=0,5&hl=en",541,"2021-07-31 07:13:36","","","","",,,,,1,1.00,0,5,1,"The incidence of nonalcoholic fatty liver disease(NAFLD) is increasing worldwide, and it is strongly associated with metabolic syndrome (MetS) and some obesity-related indices. However, few studies have investigated gender differences in these associations. The aim of this study …","https://www.mdpi.com/1660-4601/18/3/857/pdf","https://scholar.google.com/scholar?q=related:6ZyC62luIigJ:scholar.google.com/&scioq=%22impaired+glucose+tolerance%22+nigeria&hl=en&as_sdt=0,5&as_ylo=2020&as_yhi=2021&as_vis=1"
0,"Ö Yüzügülen, Hİ Erdoğdu","PREDİYABET HASTALARINDA D VİTAMİNİ VE PARATHORMONA GÖRE İNSÜLİN DİRENCİNİN DEĞERLENDİRİLMESİ",,"Sakarya Tıp Dergisi","dergipark.org.tr","https://dergipark.org.tr/en/pub/smj/issue/55849/683489","",542,"2021-07-31 07:13:36","","","","",,,,,0,0.00,0,2,,"… Anahtar Kelimeler Prediyabet, insülin direnci, vitamin D, parathormon Abstract Objective Impaired fasting glucose (IFG) and impaired glucose tolerance (IGT) increase the risk of Diabetes Mellitus (DM) … Nigerian journal of clinical practice 2015 ;18(3) 377-80. Kaynaklar","https://dergipark.org.tr/en/download/article-file/953707","https://scholar.google.com/scholar?q=related:-iCn1KfkJv0J:scholar.google.com/&scioq=%22impaired+glucose+tolerance%22+nigeria&hl=en&as_sdt=0,5&as_ylo=2020&as_yhi=2021&as_vis=1"
0,"LT Amere, A Olukoya Adesola, MJ Olatade…","Knowledge, Attitude And Practices Regarding Lifestyle Modifications Among Type 2 Diabetes Mellitus Patients Attending Diabetic Clinic At General Hospital …",,"researchgate.net","","https://www.researchgate.net/profile/Margaret-Okwuikpo-2/publication/341905207_Knowledge_Attitude_And_Practices_Regarding_Lifestyle_Modifications_Among_Type_2_Diabetes_Mellitus_Patients_Attending_Diabetic_Clinic_At_General_Hospital_Gbagada_Lagos_State/links/6006b9c945851553a053ffdf/Knowledge-Attitude-And-Practices-Regarding-Lifestyle-Modifications-Among-Type-2-Diabetes-Mellitus-Patients-Attending-Diabetic-Clinic-At-General-Hospital-Gbagada-Lagos-State.pdf","",543,"2021-07-31 07:13:36","PDF","","","",,,,,0,0.00,0,4,,"… [18] Mollentze, W., & Levitt, N. (2015). Diabetes mellitus and impaired glucose tolerance in South Africa … Health Behaviour and Quality of Life of Patients with Type 2 Diabetes Attending Selected Hospitals in South Western Nigeria. West Indian Med J., 61 (6): 619-626 …","https://www.researchgate.net/profile/Margaret-Okwuikpo-2/publication/341905207_Knowledge_Attitude_And_Practices_Regarding_Lifestyle_Modifications_Among_Type_2_Diabetes_Mellitus_Patients_Attending_Diabetic_Clinic_At_General_Hospital_Gbagada_Lagos_State/links/6006b9c945851553a053ffdf/Knowledge-Attitude-And-Practices-Regarding-Lifestyle-Modifications-Among-Type-2-Diabetes-Mellitus-Patients-Attending-Diabetic-Clinic-At-General-Hospital-Gbagada-Lagos-State.pdf","https://scholar.google.com/scholar?q=related:-qhieq_GYQkJ:scholar.google.com/&scioq=%22impaired+glucose+tolerance%22+nigeria&hl=en&as_sdt=0,5&as_ylo=2020&as_yhi=2021&as_vis=1"
0,"World Health Organization","Report of expert and stakeholder consultations on the WHO Global Diabetes Compact",2021,"","apps.who.int","https://apps.who.int/iris/handle/10665/340322","",544,"2021-07-31 07:13:36","","","","",,,,,0,0.00,0,1,1,"… Moreover, how best to implement these interventions has not been sufficiently studied. The body of evidence that diabetes is preventable in people at high risk, defined as impaired glucose tolerance (IGT), is convincing. However …","https://apps.who.int/iris/bitstream/handle/10665/340322/9789240019782-eng.pdf?sequence=1",""
4,"NI Mongalo, SS Mashele, TJ Makhafola","Ziziphus mucronata Willd.(Rhamnaceae): it's botany, toxicity, phytochemistry and pharmacological activities",2020,"Heliyon","Elsevier","https://www.sciencedirect.com/science/article/pii/S2405844020305533","https://scholar.google.com/scholar?cites=8441104488100167169&as_sdt=2005&sciodt=0,5&hl=en",545,"2021-07-31 07:13:36","HTML","","","",,,,,4,4.00,1,3,1,"","https://www.sciencedirect.com/science/article/pii/S2405844020305533","https://scholar.google.com/scholar?q=related:AX4qHc_TJHUJ:scholar.google.com/&scioq=%22impaired+glucose+tolerance%22+nigeria&hl=en&as_sdt=0,5&as_ylo=2020&as_yhi=2021&as_vis=1"
