Cites,Authors,Title,Year,Source,Publisher,ArticleURL,CitesURL,GSRank,QueryDate,Type,DOI,ISSN,CitationURL,Volume,Issue,StartPage,EndPage,ECC,CitesPerYear,CitesPerAuthor,AuthorCount,Age,Abstract,FullTextURL,RelatedURL
2,"H Al Doghaither, E Elmorsy, A Al-Ghafari…","Roles of oxidative stress, apoptosis, and inflammation in metal-induced dysfunction of beta pancreatic cells isolated from CD1 mice",2021,"Saudi journal of …","Elsevier","https://www.sciencedirect.com/science/article/pii/S1319562X20305441","https://scholar.google.com/scholar?cites=11492605201620495116&as_sdt=2005&sciodt=0,5&hl=en",167,"2021-07-31 07:13:36","HTML","","","",,,,,2,2.00,1,4,1,"JavaScript is disabled on your browser. Please enable JavaScript to use all the features on this page. Skip to main content Skip to article …","https://www.sciencedirect.com/science/article/pii/S1319562X20305441","https://scholar.google.com/scholar?q=related:DGtlWorvfZ8J:scholar.google.com/&scioq=%22impaired+glucose+tolerance%22+nigeria&hl=en&as_sdt=0,5&as_ylo=2020&as_yhi=2021&as_vis=1"
21,"D Asiimwe, GO Mauti, R Kiconco","Prevalence and risk factors associated with type 2 diabetes in elderly patients aged 45-80 years at Kanungu District",2020,"Journal of diabetes research","hindawi.com","https://www.hindawi.com/journals/jdr/2020/5152146/","https://scholar.google.com/scholar?cites=3028699256832203599&as_sdt=2005&sciodt=0,5&hl=en",168,"2021-07-31 07:13:36","HTML","","","",,,,,21,21.00,7,3,1,"… 5]. Globally, according to the International Diabetes Federa- tion (IDF), there are 352 million adults with impaired glucose tolerance which is a … Problems associated with treatment compliance among type 2 diabetic patients at a tertiary health institution in Nigeria,” African Journal …","https://www.hindawi.com/journals/jdr/2020/5152146/","https://scholar.google.com/scholar?q=related:Txv5Zu0ZCCoJ:scholar.google.com/&scioq=%22impaired+glucose+tolerance%22+nigeria&hl=en&as_sdt=0,5&as_ylo=2020&as_yhi=2021&as_vis=1"
0,"OA Osman, AA Saeed, MA Mousnad, A Hamid","ASSESSMENT OF THE RISK OF TYPE 2 DIABETES AMONG HEALTHY WITHOUT DIABETES IN SUDAN USING THE FINDRISC TOOL",2020,"","repo.nusu.edu.sd","http://repo.nusu.edu.sd/handle/123456789/182","",169,"2021-07-31 07:13:36","","","","",,,,,0,0.00,0,4,1,"… in Community-based settings, a study conducted in Libya by Abduelkarem et al.,26, second study in Nigeria by Alebiosu … Rajala U, Laakso M, Qiao Q, Keinanen-Kiukaanniemi S. Prevalence of retinopathy in people with diabetes, impaired glucose tolerance and normal glucose …","http://repo.nusu.edu.sd/bitstream/handle/123456789/182/ASSESSMENT_OF_THE_RISK_OF_TYPE_2_DIABETES_AMONG_HE.pdf?sequence=1&isAllowed=y","https://scholar.google.com/scholar?q=related:frymDmQX5QMJ:scholar.google.com/&scioq=%22impaired+glucose+tolerance%22+nigeria&hl=en&as_sdt=0,5&as_ylo=2020&as_yhi=2021&as_vis=1"
0,"L del Bosque-Plata, E Martínez-Martínez…","The Role of TCF7L2 in Type 2 Diabetes",2021,"Diabetes","Am Diabetes Assoc","https://diabetes.diabetesjournals.org/content/early/2021/05/14/db20-0573.abstract","",170,"2021-07-31 07:13:36","","","","",,,,,0,0.00,0,3,1,"… HapA lineage presents an unusual degree of divergence that ranges from 10% in the Yoruba population of Nigeria (YRI) to 58% in a population … (22) showed that total TCF7L2 expression is reduced 20% in adipose tissue of subjects with impaired glucose tolerance and adipose …","https://diabetes.diabetesjournals.org/content/diabetes/early/2021/05/14/db20-0573.full.pdf","https://scholar.google.com/scholar?q=related:BvL1m6SRjJ0J:scholar.google.com/&scioq=%22impaired+glucose+tolerance%22+nigeria&hl=en&as_sdt=0,5&as_ylo=2020&as_yhi=2021&as_vis=1"
0,"OJ Olabanji, CW Paul, TI Chinnah","Effect of Moringa oleifera Leaf Extract on Foetal Pancreatic Development in Streptozotocin-Induced Diabetic Wistar Rats",,"ijisrt.com","","https://ijisrt.com/assets/upload/files/IJISRT20FEB437_(1).pdf","",171,"2021-07-31 07:13:36","PDF","","","",,,,,0,0.00,0,3,,"… Corresponding Author: Olabanji OJ. Department of Anatomy, Faculty of Basic Medical Sciences, College of Medicine, University of Port Harcourt, Nigeria … conditions like type 2 diabetes, impaired glucose tolerance obesity, macrosomia, intrauterine growth retardation 1-3 …","https://ijisrt.com/assets/upload/files/IJISRT20FEB437_(1).pdf","https://scholar.google.com/scholar?q=related:O_L6pPBmaZ4J:scholar.google.com/&scioq=%22impaired+glucose+tolerance%22+nigeria&hl=en&as_sdt=0,5&as_ylo=2020&as_yhi=2021&as_vis=1"
24,"BL Furman, M Candasamy, SK Bhattamisra…","Reduction of blood glucose by plant extracts and their use in the treatment of diabetes mellitus; discrepancies in effectiveness between animal and human studies",2020,"Journal of …","Elsevier","https://www.sciencedirect.com/science/article/pii/S0378874119318665","https://scholar.google.com/scholar?cites=8861250916811534276&as_sdt=2005&sciodt=0,5&hl=en",172,"2021-07-31 07:13:36","","","","",,,,,24,24.00,6,4,1,"","","https://scholar.google.com/scholar?q=related:xO8nisJ8-XoJ:scholar.google.com/&scioq=%22impaired+glucose+tolerance%22+nigeria&hl=en&as_sdt=0,5&as_ylo=2020&as_yhi=2021&as_vis=1"
2,"FA Alassaf, MHM Jasim, M Alfahad, ME Qazzaz…","Effects of bee propolis on FBG, HbA1c and insulin resistance in healthy volunteers",2020,"diabetes","cms.galenos.com.tr","http://cms.galenos.com.tr/Uploads/Article_40263/TJPS-0-0-En.pdf","https://scholar.google.com/scholar?cites=5402224924843614846&as_sdt=2005&sciodt=0,5&hl=en",173,"2021-07-31 07:13:36","PDF","","","",,,,,2,2.00,0,5,1,"… and protects biological membranes from lipid peroxidation.14 Oxidative stress is involved, among others, in β-cell dysfunction, insulin resistance, impaired glucose tolerance and a … Hepatoprotective and Pancreatoprotective Properties of the Ethanolic Extract of Nigerian Propolis …","http://cms.galenos.com.tr/Uploads/Article_40263/TJPS-0-0-En.pdf","https://scholar.google.com/scholar?q=related:fqIQavKO-EoJ:scholar.google.com/&scioq=%22impaired+glucose+tolerance%22+nigeria&hl=en&as_sdt=0,5&as_ylo=2020&as_yhi=2021&as_vis=1"
0,"MM SHALABI, RIM ISMAEL, FM HABIB, JP PRINCE…","Assessment of common maternal risk factors related to gestational diabetes among pregnant women in KAMC, Riyadh",2021,"","repository.ajsrp.com","https://repository.ajsrp.com/xmlui/handle/123456789/1261","",174,"2021-07-31 07:13:36","","","","",,,,,0,0.00,0,5,1,"… been diagnosed with gestational diabetes before. 21.4% have prediabetes or impaired glucose tolerance and 9.1% had a stillbirth on a previous delivery … Have you been told that you have prediabetes or impaired glucose tolerance 96 21.4 353 78.6 *0.000 …","https://repository.ajsrp.com/xmlui/bitstream/handle/123456789/1261/03.pdf?sequence=1","https://scholar.google.com/scholar?q=related:FCaQH7F-BYQJ:scholar.google.com/&scioq=%22impaired+glucose+tolerance%22+nigeria&hl=en&as_sdt=0,5&as_ylo=2020&as_yhi=2021&as_vis=1"
0,"SO Oyedemi, K Eze, OA Aiyegoro, RC Ibeh…","Computational, chemical profiling and biochemical evaluation of antidiabetic potential of Parkia biglobosa stem bark extract in type 2 model of rats",2021,"Journal of …","Taylor & Francis","https://www.tandfonline.com/doi/abs/10.1080/07391102.2021.1938228","",175,"2021-07-31 07:13:36","","10.1080/07391102.2021.1938228","","",,,,,0,0.00,0,5,1,"… Nigeria, a country of over 200 million populations, has 54 million overweight, 18 million obese adults, and 7.7 million diabetic adults with little or no access to efficient and affordable treatment (World Health Organization, 2016) …","",""
0,"IJ Aliyeva","COMPARATIVE ASSESSMENT OF CHANGES IN THE INCIDENCE OF TYPE I DIABETES MELLITUS IN THE REGIONS WITH ITS HIGH AND LOW …",2021,"Медичні перспективи","cyberleninka.ru","https://cyberleninka.ru/article/n/comparative-assessment-of-changes-in-the-incidence-of-type-i-diabetes-mellitus-in-the-regions-with-its-high-and-low-incidence","",176,"2021-07-31 07:13:36","HTML","","","",,,,,0,0.00,0,1,1,"… increase in fasting glucose: 6.1 (110); 5.0 (90) and 5.6 (101); • impaired glucose tolerance: 7.8 (140); 6.5 (117) and 7.2 (130); … Prevalence of type - 2 diabetes mellitus amongst suspected subjects in Agbor, Delta State, Nigeria and its relationship with age and gender …","https://cyberleninka.ru/article/n/comparative-assessment-of-changes-in-the-incidence-of-type-i-diabetes-mellitus-in-the-regions-with-its-high-and-low-incidence",""
0,"L Chetty, N Govender, GM Govender…","Demographic stratification of Type 2 diabetes and comorbidities in district healthcare in KwaZulu-Natal.",2021,"South African Family …","go.gale.com","https://go.gale.com/ps/i.do?id=GALE%7CA659319547&sid=googleScholar&v=2.1&it=r&linkaccess=abs&issn=20786190&p=AONE&sw=w","",177,"2021-07-31 07:13:36","","","","",,,,,0,0.00,0,4,1,"Use this link to get back to this page. Select. For the best user experience on this site, you should have JavaScript enabled in your browser. Skip to Content Google Scholar Discovery Partner. Close. Library Information. Library Website. View Gale Product Menu. Sign in bar …","https://scholar.archive.org/work/h4igdbzzgbh4vdrcrlthkzphea/access/wayback/https://safpj.co.za/index.php/safpj/article/download/5218/6697","https://scholar.google.com/scholar?q=related:qmxfzxRRFikJ:scholar.google.com/&scioq=%22impaired+glucose+tolerance%22+nigeria&hl=en&as_sdt=0,5&as_ylo=2020&as_yhi=2021&as_vis=1"
0,"M Ross, B Purrington, C Zuniga…","Survey of physical therapists' knowledge of screening and management practices for patients with prediabetes",2020,"Physiotherapy …","content.iospress.com","https://content.iospress.com/articles/physiotherapy-practice-and-research/ppr190384","",178,"2021-07-31 07:13:36","","","","",,,,,0,0.00,0,4,1,"… risk factors for non-communicable diseases for physical therapists in Nigeria and primary … [16]. Abaraogu UO , Ogaga MO , Dean E . Practices of Nigerian physiotherapists with respect to … Effects of diet and exercise in preventing NIDDM in people with impaired glucose tolerance …","","https://scholar.google.com/scholar?q=related:R8yDle06E5cJ:scholar.google.com/&scioq=%22impaired+glucose+tolerance%22+nigeria&hl=en&as_sdt=0,5&as_ylo=2020&as_yhi=2021&as_vis=1"
0,"G León-Reyes, B Rivera-Paredez, JCF López…","The Variant rs1784042 of the SIDT2 Gene is Associated with Metabolic Syndrome through Low HDL-c Levels in a Mexican Population",2020,"Genes","mdpi.com","https://www.mdpi.com/855444","",179,"2021-07-31 07:13:36","","","","",,,,,0,0.00,0,4,1,"… impair lipid metabolism [18]. In addition, the knock out mice model showed an impaired glucose tolerance due insulin secretion dysfunction, suggesting that SIDT2 may be also involved in glucose metabolism [22,23]. Mexico is a …","https://www.mdpi.com/2073-4425/11/10/1192/pdf","https://scholar.google.com/scholar?q=related:dsksMRulbVgJ:scholar.google.com/&scioq=%22impaired+glucose+tolerance%22+nigeria&hl=en&as_sdt=0,5&as_ylo=2020&as_yhi=2021&as_vis=1"
1,"Z Khudhair, R Alhallaf, RM Eichenberger…","Gastrointestinal helminth infection improves insulin sensitivity, decreases systemic inflammation, and alters the composition of gut microbiota in distinct mouse …",2021,"Frontiers in …","frontiersin.org","https://www.frontiersin.org/articles/10.3389/fendo.2020.606530/full","https://scholar.google.com/scholar?cites=16324976961377748681&as_sdt=2005&sciodt=0,5&hl=en",180,"2021-07-31 07:13:36","HTML","","","",,,,,1,1.00,0,4,1,"… According to the International Diabetes Federation there were 424.9 million people living with diabetes, and a further 352.1 million with impaired glucose tolerance in 2017 (1). Diabetes caused 4 million deaths and accounted for 10.7% of global all-cause mortality and cost USD …","https://www.frontiersin.org/articles/10.3389/fendo.2020.606530/full","https://scholar.google.com/scholar?q=related:yUZbjQ34jeIJ:scholar.google.com/&scioq=%22impaired+glucose+tolerance%22+nigeria&hl=en&as_sdt=0,5&as_ylo=2020&as_yhi=2021&as_vis=1"
1,"F Mghanga, E Maduhu, H Nyawale","Prevalence and associated factors of gestational diabetes mellitus among rural pregnant women in southern Tanzania",2020,"Ghana Medical Journal","ajol.info","https://www.ajol.info/index.php/gmj/article/view/199346","https://scholar.google.com/scholar?cites=14654142172542210472&as_sdt=2005&sciodt=0,5&hl=en",181,"2021-07-31 07:13:36","","","","",,,,,1,1.00,0,3,1,"… another study conducted three decades earlier using the 1985 diagnostic criteria, reported zero prevalence of GDM and impaired glucose tolerance in pregnant … Adendokum AO, Eneli A, KuKu SF: Prevalence of gestational diabetes mellitus in 221 consecutive Nigerian women …","https://www.ajol.info/index.php/gmj/article/view/199346/187946","https://scholar.google.com/scholar?q=related:qBFzOqr4XcsJ:scholar.google.com/&scioq=%22impaired+glucose+tolerance%22+nigeria&hl=en&as_sdt=0,5&as_ylo=2020&as_yhi=2021&as_vis=1"
0,"GJ Kutlieva, NA Elova, BI Turaeva…","Study of the Influence of Local Strains of Lactobacillus on the Experimental Model of Ulcerative Colitis",2021,"Journal of …","journaljpri.com","https://www.journaljpri.com/index.php/JPRI/article/view/31290","",182,"2021-07-31 07:13:36","","","","",,,,,0,0.00,0,4,1,"… Reviewers: (1) Ogochukwu Lilian Obi, Federal Medical Centre, Nigeria … Most of these drugs have pronounced side effects: impaired glucose tolerance, suppression of adrenal function, osteoporosis and ulcerative lesions of the stomach and duodenum, development of …","https://www.journaljpri.com/index.php/JPRI/article/download/31290/58728","https://scholar.google.com/scholar?q=related:y7FPi3HK-HEJ:scholar.google.com/&scioq=%22impaired+glucose+tolerance%22+nigeria&hl=en&as_sdt=0,5&as_ylo=2020&as_yhi=2021&as_vis=1"
26,"G Bjørklund, M Dadar, L Pivina…","The role of zinc and copper in insulin resistance and diabetes mellitus",2020,"Current medicinal …","ingentaconnect.com","https://www.ingentaconnect.com/content/ben/cmc/2020/00000027/00000039/art00006","https://scholar.google.com/scholar?cites=10156493160537294443&as_sdt=2005&sciodt=0,5&hl=en",183,"2021-07-31 07:13:36","","","","",,,,,26,26.00,7,4,1,"… The authors also noted that the dysfunction of the Zn trans- porter SLC30A8 (ZnT8) and a decrease in plasma Zn concentration lead to impaired glucose tolerance and diabetes [52]. A recent study performed in Turkish pa- tients with T2DM demonstrated that plasma Zn levels …","","https://scholar.google.com/scholar?q=related:a4aC1bcc84wJ:scholar.google.com/&scioq=%22impaired+glucose+tolerance%22+nigeria&hl=en&as_sdt=0,5&as_ylo=2020&as_yhi=2021&as_vis=1"
12,"TO Yahaya, TF Salisu","A review of type 2 diabetes mellitus predisposing genes",2020,"Current diabetes reviews","ingentaconnect.com","https://www.ingentaconnect.com/content/ben/cdr/2020/00000016/00000001/art00006","https://scholar.google.com/scholar?cites=6094783187202853227&as_sdt=2005&sciodt=0,5&hl=en",184,"2021-07-31 07:13:36","","","","",,,,,12,12.00,6,2,1,"… Address correspondence to this author at the Department of Biology, Fed- eral University Birnin Kebbi, Kebbi State, Nigeria; Tel: +234 8033550788; +234 … Pancreatic -cell-specific HNF1B deletion resulted in impaired glucose tolerance with reduced insulin secretion [89] …","https://www.researchgate.net/profile/Tajudeen-Yahaya/publication/329406815_A_Review_of_Type_2_Diabetes_Mellitus_Predisposing_Genes/links/5e11aa73a6fdcc283757c96f/A-Review-of-Type-2-Diabetes-Mellitus-Predisposing-Genes.pdf","https://scholar.google.com/scholar?q=related:a8k_aAQFlVQJ:scholar.google.com/&scioq=%22impaired+glucose+tolerance%22+nigeria&hl=en&as_sdt=0,5&as_ylo=2020&as_yhi=2021&as_vis=1"
0,"WT Mutika, K Bantas, R Djuwita","Characteristics of Patients with Type 2 Diabetes Mellitus.",2021,"Indian Journal of Public …","search.ebscohost.com","http://search.ebscohost.com/login.aspx?direct=true&profile=ehost&scope=site&authtype=crawler&jrnl=09760245&AN=150115724&h=LvknbQZCu7WUqgtXZyGmabBYvY1P0RXtZv%2BKrjZiKkyXAUAH8HoJV%2FU1q0kMjFAmsL4WnQAfbag1a8WrxL1gVg%3D%3D&crl=c","",185,"2021-07-31 07:13:36","","","","",,,,,0,0.00,0,3,1,"… Diabetic Care study 35 but differed from the findings of other Nigerian studies that … patients attending the general outpatient clinic in the National Hospital, Abuja, Nigeria(10) … 15–25% of first-degree relatives of patients with T2DM develop impaired glucose tolerance or diabetes …","","https://scholar.google.com/scholar?q=related:8Dk2D0ReOEcJ:scholar.google.com/&scioq=%22impaired+glucose+tolerance%22+nigeria&hl=en&as_sdt=0,5&as_ylo=2020&as_yhi=2021&as_vis=1"
0,"JC Sardar, PR Karmakar","A Study on Risk Factors of Diabetes Mellitus among Workers of a Medical College of Kolkata, India",,"Age","academia.edu","https://www.academia.edu/download/61727769/I181212424620200109-58928-15aw4c1.pdf","",186,"2021-07-31 07:13:36","PDF","","","",,,,,0,0.00,0,2,,"… ICMR– INDIAB Collaborative Study Group Prevalence of diabetes and prediabetes (impaired fasting glucose and/or impaired glucose tolerance) in urban and rural … O. Risk factors for diabetes mellitus among adult residents of a rural District in Southern Nigeria: Implications for …","https://www.academia.edu/download/61727769/I181212424620200109-58928-15aw4c1.pdf","https://scholar.google.com/scholar?q=related:-KoMzQDNW9QJ:scholar.google.com/&scioq=%22impaired+glucose+tolerance%22+nigeria&hl=en&as_sdt=0,5&as_ylo=2020&as_yhi=2021&as_vis=1"
0,"MP Santhosh Kumar","PREVALENCE OF COEXISTING DIABETES MELLITUS AND HYPERTENSION AMONG DENTAL PATIENTS IN SOUTH INDIAN POPULATION.",2021,"International Journal of Clinical …","search.ebscohost.com","http://search.ebscohost.com/login.aspx?direct=true&profile=ehost&scope=site&authtype=crawler&jrnl=19395833&AN=150954675&h=sYDFcifoK8klVrJZ7rFtIM7rXaZcObglaMS9pbIWXT2%2B22HvC23tbCZH8zBnMCNiViHP%2B%2FCGuuwiBZeot4VgVg%3D%3D&crl=c","",187,"2021-07-31 07:13:36","","","","",,,,,0,0.00,0,1,1,"… In the Nigerian study by OI O et al … PI, Akhionbare O. Prevalence of undiagnosed diabetes mellitus among dental patients in Edo State, Nigeria … Prevalence of Diabetes, Impaired Fasting Glucose, and Impaired Glucose Tolerance in US Adults: The Third National Health and …","","https://scholar.google.com/scholar?q=related:7_15SaSR_7AJ:scholar.google.com/&scioq=%22impaired+glucose+tolerance%22+nigeria&hl=en&as_sdt=0,5&as_ylo=2020&as_yhi=2021&as_vis=1"
0,"MW Shumye, B Tegegne, S Ademe…","The Magnitude of Diabetes Mellitus in Adult Hypertensive Patients in Northeast Ethiopia",2021,"… and Obesity: Targets …","ncbi.nlm.nih.gov","https://www.ncbi.nlm.nih.gov/pmc/articles/pmc7797297/","",188,"2021-07-31 07:13:36","HTML","","","",,,,,0,0.00,0,4,1,"… Dessie Comprehensive Specialized Hospital; FPG, fasting plasma glucose; HPN, hypertension; IDF, International Diabetes Federation; IFG, impaired fasting glucose; IGT, impaired glucose tolerance; NCD, non … Cardiovascular risk factors in a suburban community in Nigeria …","https://www.ncbi.nlm.nih.gov/pmc/articles/pmc7797297/","https://scholar.google.com/scholar?q=related:9yma16xC5UYJ:scholar.google.com/&scioq=%22impaired+glucose+tolerance%22+nigeria&hl=en&as_sdt=0,5&as_ylo=2020&as_yhi=2021&as_vis=1"
0,"O Oyebode, L Zuma, O Lucky Erukainure…","Bridelia ferruginea inhibits key carbohydrate digesting enzyme and intestinal glucose absorption and modulates glucose metabolism in diabetic rats",2020,"… of Physiology and …","Taylor & Francis","https://www.tandfonline.com/doi/abs/10.1080/13813455.2020.1861026","",189,"2021-07-31 07:13:36","","10.1080/13813455.2020.1861026","","",,,,,0,0.00,0,4,1,"… The leaves (3 kg) of B. ferruginea were harvested from Ibadan, Oyo State, Nigeria and validated by Sonibare MA and Agwu OP at the herbarium unit of the Department of Pharmacognosy, University of Ibadan, Nigeria, where a specimen number DPHI 1380 was kept …","","https://scholar.google.com/scholar?q=related:8f2VxG6AFc0J:scholar.google.com/&scioq=%22impaired+glucose+tolerance%22+nigeria&hl=en&as_sdt=0,5&as_ylo=2020&as_yhi=2021&as_vis=1"
0,"LF Owolabi, B Adamu, AI Imam…","Systematic review and meta-analysis estimating the prevalence, burden, and trend of diabetes mellitus in Saudi Arabia",2020,"Journal of Diabetes …","jdeponline.com","https://www.jdeponline.com/article.asp?issn=2772-7653;year=2020;volume=3;issue=1;spage=1;epage=8;aulast=Owolabi","",190,"2021-07-31 07:13:36","HTML","","","",,,,,0,0.00,0,4,1,"… of Bisha, Bisha, Saudi Arabia 2 Department of Medicine/Psychiatry, Aminu Kano Teaching Hospital, Bayero University, Kano, Nigeria … for a macrovascular and microvascular disease which correspond with the levels for the diagnosis of impaired glucose tolerance and diabetes …","https://www.jdeponline.com/article.asp?issn=2772-7653;year=2020;volume=3;issue=1;spage=1;epage=8;aulast=Owolabi","https://scholar.google.com/scholar?q=related:Uxhi2nE5XyoJ:scholar.google.com/&scioq=%22impaired+glucose+tolerance%22+nigeria&hl=en&as_sdt=0,5&as_ylo=2020&as_yhi=2021&as_vis=1"
0,"E Školníková","Nutrigenomic analysis of diet influence in prenatal and early development on metabolic syndrome aspects manifestation in adulthood.",2021,"","dspace.cuni.cz","https://dspace.cuni.cz/handle/20.500.11956/124541","",191,"2021-07-31 07:13:36","","","","",,,,,0,0.00,0,1,1,"… Metabolic syndrome is represented by concurrence of several conditions - dyslipidaemia, obesity, hypertension or impaired glucose tolerance - altered metabolic phenotypes related to genetic and environmental factors. Recent studies suggest that early-life exposure to certain …","https://dspace.cuni.cz/bitstream/handle/20.500.11956/124541/140090718.pdf?sequence=1","https://scholar.google.com/scholar?q=related:6-KKLSaJDGkJ:scholar.google.com/&scioq=%22impaired+glucose+tolerance%22+nigeria&hl=en&as_sdt=0,5&as_ylo=2020&as_yhi=2021&as_vis=1"
0,"HM Balaky, IS Kakey","Alterations of Obestatin, Cardiac Markers and Lipid Profile Levels in Type 2 Diabetes Mellitus",2021,"Iraqi Journal of Science","ijs.uobaghdad.edu.iq","https://ijs.uobaghdad.edu.iq/index.php/eijs/article/view/2930","",192,"2021-07-31 07:13:36","","","","",,,,,0,0.00,0,2,1,"… The correlation analysis showed obestatin to be independently correlated with impaired glucose tolerance and T2DM … 'Serum obestatin and omentin levels in patients with diabetic nephropathy', Nigerian Journal of Clinical Practice, 20(2): 182–7. 4. Granata, R.; Settanni, F …","https://ijs.uobaghdad.edu.iq/index.php/eijs/article/download/2930/1482",""
1,"S Bhattacharya, M Srinivas","Correlation of Vitamin D levels in Indian diabetic population in comparison to nondiabetic controls",2020,"Int Arch Integr Med","iaimjournal.com","https://iaimjournal.com/wp-content/uploads/2020/02/iaim_2020_0702_07.pdf","https://scholar.google.com/scholar?cites=13051324177549118051&as_sdt=2005&sciodt=0,5&hl=en",193,"2021-07-31 07:13:36","PDF","","","",,,,,1,1.00,1,2,1,"… A study done in Nigeria showed that Vitamin D3 supplementation in persons with T2DM and Vitamin D deficiency resulted in a significant improvement in glycemic control [16] … 10. Sicree R, Shaw J, Zimmet P. Diabetes and impaired glucose tolerance. In: Gan D, editor …","https://iaimjournal.com/wp-content/uploads/2020/02/iaim_2020_0702_07.pdf","https://scholar.google.com/scholar?q=related:Y0pIyzCeH7UJ:scholar.google.com/&scioq=%22impaired+glucose+tolerance%22+nigeria&hl=en&as_sdt=0,5&as_ylo=2020&as_yhi=2021&as_vis=1"
2,"M Woldu, O Minzi, E Engidawork","Prevalence of cardiometabolic syndrome in HIV-infected persons: a systematic review",2020,"Journal of Diabetes & Metabolic …","Springer","https://link.springer.com/content/pdf/10.1007/s40200-020-00552-x.pdf","https://scholar.google.com/scholar?cites=1400547680983152059&as_sdt=2005&sciodt=0,5&hl=en",194,"2021-07-31 07:13:36","","10.1007/s40200-020-00552-x","","",,,,,2,2.00,1,3,1,"… CMetS is a constellation of metabolic dysfunctions includ- ing insulin resistance, impaired glucose tolerance, atherogenic dyslipidemia (high serum Triglycerides (TGs), and low High- Density Lipoprotein (HDL) levels), hypertension, intra- abdominal adiposity, and high blood …","https://www.ncbi.nlm.nih.gov/pmc/articles/PMC7843841/","https://scholar.google.com/scholar?q=related:u3X_B7K-bxMJ:scholar.google.com/&scioq=%22impaired+glucose+tolerance%22+nigeria&hl=en&as_sdt=0,5&as_ylo=2020&as_yhi=2021&as_vis=1"
0,"TAF Corrêa, MM Rogero","Diabetes, microRNA, and Nutrition in Geriatrics",2020,"Current Geriatrics Reports","Springer","https://link.springer.com/article/10.1007/s13670-020-00336-4","",195,"2021-07-31 07:13:36","","10.1007/s13670-020-00336-4","","",,,,,0,0.00,0,2,1,"… Type 2 diabetes (T2D) is characterized by hyperglycemia caused by impaired glucose tolerance following the development of insulin resistance (IR) and … Problems associated with treatment compliance among type 2 diabetic patients at a tertiary health institution in Nigeria …","","https://scholar.google.com/scholar?q=related:pE5K1GeTle8J:scholar.google.com/&scioq=%22impaired+glucose+tolerance%22+nigeria&hl=en&as_sdt=0,5&as_ylo=2020&as_yhi=2021&as_vis=1"
